id,category,error_name,user_error_text,symptoms,cause,step_1,step_2,step_3,step_4,step_5,verification,risk,os_version,device_type,tag,log_snippet
AUDIOV1-0974,OS Services & System Audio Failures,Audio endpoint builder failed,After update I see: Audio endpoint builder failed. No sound plays.,"Symptoms: Audio endpoint builder failed. Sound missing, distorted, or devices not detected. Category: OS Services & System Audio Failures.","Windows audio services stopped, system file corruption, or interrupted updates.",Open Services.msc and ensure Windows Audio and Windows Audio Endpoint Builder services are running.,Run `sfc /scannow` and `DISM /Online /Cleanup-Image /RestoreHealth` to repair system files.,Uninstall recent audio-related Windows updates if audio broke after update.,Create a new Windows user account to rule out profile corruption affecting audio.,"If unresolved, backup data and perform a system repair or in-place upgrade.",Audio functions correctly and devices are detected; no more audio errors.,high,Windows 10,All-in-One,Audio_endpoint_builder_failed,Audio endpoint builder failed - Audio system event logged in Event Viewer.
AUDIOV1-0721,Bluetooth Audio Problems,Frequent disconnections,Frequent disconnections — microphone not recording properly.,"Symptoms: Frequent disconnections. Sound missing, distorted, or devices not detected. Category: Bluetooth Audio Problems.","Bluetooth pairing issues, codec mismatch, or low battery in headset.",Ensure Bluetooth headset is paired and set as default audio device.,Remove/forget the device and pair it again; check battery level on headset.,Update Bluetooth drivers and ensure Bluetooth service is running.,Switch codec settings if available (AAC/aptX) or use SBC as fallback.,Test headset on another device to confirm it's not a headset issue.,Audio functions correctly and devices are detected; no more audio errors.,high,Windows 11,Desktop,Frequent_disconnections,Frequent disconnections - Audio system event logged in Event Viewer.
AUDIOV1-0706,Bluetooth Audio Problems,Pairing fails intermittently,Pairing fails intermittently — microphone not recording properly.,"Symptoms: Pairing fails intermittently. Sound missing, distorted, or devices not detected. Category: Bluetooth Audio Problems.","Bluetooth pairing issues, codec mismatch, or low battery in headset.",Ensure Bluetooth headset is paired and set as default audio device.,Remove/forget the device and pair it again; check battery level on headset.,Update Bluetooth drivers and ensure Bluetooth service is running.,Switch codec settings if available (AAC/aptX) or use SBC as fallback.,Test headset on another device to confirm it's not a headset issue.,Audio functions correctly and devices are detected; no more audio errors.,medium,Windows 11,Workstation,Pairing_fails_intermittently,Pairing fails intermittently - Audio system event logged in Event Viewer.
AUDIOV1-0944,OS Services & System Audio Failures,After update no sound,After update I see: After update no sound. No sound plays.,"Symptoms: After update no sound. Sound missing, distorted, or devices not detected. Category: OS Services & System Audio Failures.","Windows audio services stopped, system file corruption, or interrupted updates.",Open Services.msc and ensure Windows Audio and Windows Audio Endpoint Builder services are running.,Run `sfc /scannow` and `DISM /Online /Cleanup-Image /RestoreHealth` to repair system files.,Uninstall recent audio-related Windows updates if audio broke after update.,Create a new Windows user account to rule out profile corruption affecting audio.,"If unresolved, backup data and perform a system repair or in-place upgrade.",Audio functions correctly and devices are detected; no more audio errors.,low,Windows 11,Laptop,After_update_no_sound,After update no sound - Audio system event logged in Event Viewer.
AUDIOV1-0008,Audio Output Not Working,No audio output,I have the issue: No audio output — how to fix?,"Symptoms: No audio output. Sound missing, distorted, or devices not detected. Category: Audio Output Not Working.","Missing or disabled audio device, corrupted driver, or faulty hardware.",Check the speaker icon in the taskbar; ensure not muted and correct output is selected.,"Open Device Manager → Sound, video and game controllers → scan for hardware changes.",Uninstall and reinstall audio driver; restart PC to let Windows re-detect devices.,Try alternative output (headphones/external speakers) to isolate hardware.,Run Windows Playing Audio troubleshooter (Settings → Troubleshoot → Playing Audio).,Audio functions correctly and devices are detected; no more audio errors.,medium,Windows 11,Workstation,No_audio_output,No audio output - Audio system event logged in Event Viewer.
AUDIOV1-0322,Audio Driver & Device Manager Problems,Device Manager warning on sound drivers,My PC shows 'Device Manager warning on sound drivers' and I can't hear anything.,"Symptoms: Device Manager warning on sound drivers. Sound missing, distorted, or devices not detected. Category: Audio Driver & Device Manager Problems.","Driver corruption, missing driver, or driver conflicts after update.","Open Device Manager, uninstall the audio driver and restart to let Windows reinstall it.",Download the latest audio driver from OEM website and install as administrator.,"If update caused issues, roll back driver in Device Manager to previous version.",Check Event Viewer for driver-related errors and address specific error codes.,Use OEM audio utilities to run diagnostics or firmware updates for USB sound devices.,Audio functions correctly and devices are detected; no more audio errors.,medium,Windows 11,Desktop,Device_Manager_warning_on_sound_drivers,Device Manager warning on sound drivers - Audio system event logged in Event Viewer.
AUDIOV1-0848,Hardware / Port Issues,Worn-out speakers,Problem: Worn-out speakers when using apps or calls.,"Symptoms: Worn-out speakers. Sound missing, distorted, or devices not detected. Category: Hardware / Port Issues.","Physical jack/cable damage, faulty microphone or speaker hardware.",Inspect headphone jack and cables for damage; try another cable.,Test speakers/headset on another device to verify hardware works.,"For USB devices, try different USB ports and reinstall the device driver.","If connector is loose, clean port and reseat connector; consider repair if physically damaged.",Replace faulty hardware if tests confirm physical failure.,Audio functions correctly and devices are detected; no more audio errors.,high,Windows 10,Workstation,Worn-out_speakers,Worn-out speakers - Audio system event logged in Event Viewer.
AUDIOV1-0526,App & Software Audio Issues,Wrong output device selected,After update I see: Wrong output device selected. No sound plays.,"Symptoms: Wrong output device selected. Sound missing, distorted, or devices not detected. Category: App & Software Audio Issues.","App-specific settings, wrong device selection, or exclusive mode causing routing issues.",Open the app's audio settings and ensure correct output/input device is selected.,Check Windows Volume Mixer to ensure the app is not muted or set to low volume.,Disable exclusive mode in Device Properties → Advanced to allow multiple apps to use audio.,Restart the app and test with another application to determine if app-specific.,Reinstall the app if settings are corrupted or reset app preferences.,Audio functions correctly and devices are detected; no more audio errors.,high,Windows 11,Workstation,Wrong_output_device_selected,Wrong output device selected - Audio system event logged in Event Viewer.
AUDIOV1-0617,Sound Settings & Configuration Errors,Muted system volume,Problem: Muted system volume when using apps or calls.,"Symptoms: Muted system volume. Sound missing, distorted, or devices not detected. Category: Sound Settings & Configuration Errors.","Incorrect device selection, muted channels, sample rate mismatch, or audio enhancements conflict.",Open Sound Settings and select the correct playback/recording device.,"Set sample rate and bit depth to a supported value (e.g., 44.1kHz or 48kHz).",Disable audio enhancements that may cause distortion.,Run Sound troubleshooter and reset sound settings if necessary.,Ensure system volume and app volumes are not muted or very low.,Audio functions correctly and devices are detected; no more audio errors.,medium,Windows 10,All-in-One,Muted_system_volume,Muted system volume - Audio system event logged in Event Viewer.
AUDIOV1-0618,Sound Settings & Configuration Errors,Sample rate mismatch,Problem: Sample rate mismatch when using apps or calls.,"Symptoms: Sample rate mismatch. Sound missing, distorted, or devices not detected. Category: Sound Settings & Configuration Errors.","Incorrect device selection, muted channels, sample rate mismatch, or audio enhancements conflict.",Open Sound Settings and select the correct playback/recording device.,"Set sample rate and bit depth to a supported value (e.g., 44.1kHz or 48kHz).",Disable audio enhancements that may cause distortion.,Run Sound troubleshooter and reset sound settings if necessary.,Ensure system volume and app volumes are not muted or very low.,Audio functions correctly and devices are detected; no more audio errors.,low,Windows 10,Desktop,Sample_rate_mismatch,Sample rate mismatch - Audio system event logged in Event Viewer.
AUDIOV1-0652,Bluetooth Audio Problems,Bluetooth headphones connected but no sound,Problem: Bluetooth headphones connected but no sound when using apps or calls.,"Symptoms: Bluetooth headphones connected but no sound. Sound missing, distorted, or devices not detected. Category: Bluetooth Audio Problems.","Bluetooth pairing issues, codec mismatch, or low battery in headset.",Ensure Bluetooth headset is paired and set as default audio device.,Remove/forget the device and pair it again; check battery level on headset.,Update Bluetooth drivers and ensure Bluetooth service is running.,Switch codec settings if available (AAC/aptX) or use SBC as fallback.,Test headset on another device to confirm it's not a headset issue.,Audio functions correctly and devices are detected; no more audio errors.,medium,Windows 10,Laptop,Bluetooth_headphones_connected_but_no_sound,Bluetooth headphones connected but no sound - Audio system event logged in Event Viewer.
AUDIOV1-0217,Microphone Input Errors,Background noise or static,After update I see: Background noise or static. No sound plays.,"Symptoms: Background noise or static. Sound missing, distorted, or devices not detected. Category: Microphone Input Errors.","Microphone disabled, wrong input selected, driver or app permission issue.",Ensure microphone is unmuted and selected as default input in Sound Settings.,Check app permissions: Settings → Privacy → Microphone → allow apps to use microphone.,"Test mic in Voice Recorder; if not detected, reinstall mic drivers.",Try different USB port or headset on another PC to rule out hardware.,Adjust mic levels and disable enhancements in Device Properties → Levels/Enhancements.,Audio functions correctly and devices are detected; no more audio errors.,low,Windows 10,All-in-One,Background_noise_or_static,Background noise or static - Audio system event logged in Event Viewer.
AUDIOV1-0053,Audio Output Not Working,Headphones plugged in but no sound,My PC shows 'Headphones plugged in but no sound' and I can't hear anything.,"Symptoms: Headphones plugged in but no sound. Sound missing, distorted, or devices not detected. Category: Audio Output Not Working.","Missing or disabled audio device, corrupted driver, or faulty hardware.",Check the speaker icon in the taskbar; ensure not muted and correct output is selected.,"Open Device Manager → Sound, video and game controllers → scan for hardware changes.",Uninstall and reinstall audio driver; restart PC to let Windows re-detect devices.,Try alternative output (headphones/external speakers) to isolate hardware.,Run Windows Playing Audio troubleshooter (Settings → Troubleshoot → Playing Audio).,Audio functions correctly and devices are detected; no more audio errors.,medium,Windows 11,All-in-One,Headphones_plugged_in_but_no_sound,Headphones plugged in but no sound - Audio system event logged in Event Viewer.
AUDIOV1-0201,Microphone Input Errors,Background noise or static,After update I see: Background noise or static. No sound plays.,"Symptoms: Background noise or static. Sound missing, distorted, or devices not detected. Category: Microphone Input Errors.","Microphone disabled, wrong input selected, driver or app permission issue.",Ensure microphone is unmuted and selected as default input in Sound Settings.,Check app permissions: Settings → Privacy → Microphone → allow apps to use microphone.,"Test mic in Voice Recorder; if not detected, reinstall mic drivers.",Try different USB port or headset on another PC to rule out hardware.,Adjust mic levels and disable enhancements in Device Properties → Levels/Enhancements.,Audio functions correctly and devices are detected; no more audio errors.,low,Windows 10,All-in-One,Background_noise_or_static,Background noise or static - Audio system event logged in Event Viewer.
AUDIOV1-0048,Audio Output Not Working,Speakers not working,I have the issue: Speakers not working — how to fix?,"Symptoms: Speakers not working. Sound missing, distorted, or devices not detected. Category: Audio Output Not Working.","Missing or disabled audio device, corrupted driver, or faulty hardware.",Check the speaker icon in the taskbar; ensure not muted and correct output is selected.,"Open Device Manager → Sound, video and game controllers → scan for hardware changes.",Uninstall and reinstall audio driver; restart PC to let Windows re-detect devices.,Try alternative output (headphones/external speakers) to isolate hardware.,Run Windows Playing Audio troubleshooter (Settings → Troubleshoot → Playing Audio).,Audio functions correctly and devices are detected; no more audio errors.,medium,Windows 11,Workstation,Speakers_not_working,Speakers not working - Audio system event logged in Event Viewer.
AUDIOV1-0888,OS Services & System Audio Failures,Windows Audio Service stopped,After update I see: Windows Audio Service stopped. No sound plays.,"Symptoms: Windows Audio Service stopped. Sound missing, distorted, or devices not detected. Category: OS Services & System Audio Failures.","Windows audio services stopped, system file corruption, or interrupted updates.",Open Services.msc and ensure Windows Audio and Windows Audio Endpoint Builder services are running.,Run `sfc /scannow` and `DISM /Online /Cleanup-Image /RestoreHealth` to repair system files.,Uninstall recent audio-related Windows updates if audio broke after update.,Create a new Windows user account to rule out profile corruption affecting audio.,"If unresolved, backup data and perform a system repair or in-place upgrade.",Audio functions correctly and devices are detected; no more audio errors.,high,Windows 10,Desktop,Windows_Audio_Service_stopped,Windows Audio Service stopped - Audio system event logged in Event Viewer.
AUDIOV1-0544,Sound Settings & Configuration Errors,Spatial Sound issues,Spatial Sound issues — microphone not recording properly.,"Symptoms: Spatial Sound issues. Sound missing, distorted, or devices not detected. Category: Sound Settings & Configuration Errors.","Incorrect device selection, muted channels, sample rate mismatch, or audio enhancements conflict.",Open Sound Settings and select the correct playback/recording device.,"Set sample rate and bit depth to a supported value (e.g., 44.1kHz or 48kHz).",Disable audio enhancements that may cause distortion.,Run Sound troubleshooter and reset sound settings if necessary.,Ensure system volume and app volumes are not muted or very low.,Audio functions correctly and devices are detected; no more audio errors.,high,Windows 10,All-in-One,Spatial_Sound_issues,Spatial Sound issues - Audio system event logged in Event Viewer.
AUDIOV1-0897,OS Services & System Audio Failures,After update no sound,Problem: After update no sound when using apps or calls.,"Symptoms: After update no sound. Sound missing, distorted, or devices not detected. Category: OS Services & System Audio Failures.","Windows audio services stopped, system file corruption, or interrupted updates.",Open Services.msc and ensure Windows Audio and Windows Audio Endpoint Builder services are running.,Run `sfc /scannow` and `DISM /Online /Cleanup-Image /RestoreHealth` to repair system files.,Uninstall recent audio-related Windows updates if audio broke after update.,Create a new Windows user account to rule out profile corruption affecting audio.,"If unresolved, backup data and perform a system repair or in-place upgrade.",Audio functions correctly and devices are detected; no more audio errors.,high,Windows 11,All-in-One,After_update_no_sound,After update no sound - Audio system event logged in Event Viewer.
AUDIOV1-0773,Hardware / Port Issues,USB audio device not detected,My PC shows 'USB audio device not detected' and I can't hear anything.,"Symptoms: USB audio device not detected. Sound missing, distorted, or devices not detected. Category: Hardware / Port Issues.","Physical jack/cable damage, faulty microphone or speaker hardware.",Inspect headphone jack and cables for damage; try another cable.,Test speakers/headset on another device to verify hardware works.,"For USB devices, try different USB ports and reinstall the device driver.","If connector is loose, clean port and reseat connector; consider repair if physically damaged.",Replace faulty hardware if tests confirm physical failure.,Audio functions correctly and devices are detected; no more audio errors.,high,Windows 10,Workstation,USB_audio_device_not_detected,USB audio device not detected - Audio system event logged in Event Viewer.
AUDIOV1-0066,Audio Output Not Working,Speakers not working,My PC shows 'Speakers not working' and I can't hear anything.,"Symptoms: Speakers not working. Sound missing, distorted, or devices not detected. Category: Audio Output Not Working.","Missing or disabled audio device, corrupted driver, or faulty hardware.",Check the speaker icon in the taskbar; ensure not muted and correct output is selected.,"Open Device Manager → Sound, video and game controllers → scan for hardware changes.",Uninstall and reinstall audio driver; restart PC to let Windows re-detect devices.,Try alternative output (headphones/external speakers) to isolate hardware.,Run Windows Playing Audio troubleshooter (Settings → Troubleshoot → Playing Audio).,Audio functions correctly and devices are detected; no more audio errors.,low,Windows 10,Workstation,Speakers_not_working,Speakers not working - Audio system event logged in Event Viewer.
AUDIOV1-0107,Audio Output Not Working,Speakers not working,Problem: Speakers not working when using apps or calls.,"Symptoms: Speakers not working. Sound missing, distorted, or devices not detected. Category: Audio Output Not Working.","Missing or disabled audio device, corrupted driver, or faulty hardware.",Check the speaker icon in the taskbar; ensure not muted and correct output is selected.,"Open Device Manager → Sound, video and game controllers → scan for hardware changes.",Uninstall and reinstall audio driver; restart PC to let Windows re-detect devices.,Try alternative output (headphones/external speakers) to isolate hardware.,Run Windows Playing Audio troubleshooter (Settings → Troubleshoot → Playing Audio).,Audio functions correctly and devices are detected; no more audio errors.,high,Windows 11,Desktop,Speakers_not_working,Speakers not working - Audio system event logged in Event Viewer.
AUDIOV1-0379,Audio Driver & Device Manager Problems,Code 10 – Device cannot start,My PC shows 'Code 10 – Device cannot start' and I can't hear anything.,"Symptoms: Code 10 – Device cannot start. Sound missing, distorted, or devices not detected. Category: Audio Driver & Device Manager Problems.","Driver corruption, missing driver, or driver conflicts after update.","Open Device Manager, uninstall the audio driver and restart to let Windows reinstall it.",Download the latest audio driver from OEM website and install as administrator.,"If update caused issues, roll back driver in Device Manager to previous version.",Check Event Viewer for driver-related errors and address specific error codes.,Use OEM audio utilities to run diagnostics or firmware updates for USB sound devices.,Audio functions correctly and devices are detected; no more audio errors.,medium,Windows 10,Tablet,Code_10_–_Device_cannot_start,Code 10 – Device cannot start - Audio system event logged in Event Viewer.
AUDIOV1-0318,Audio Driver & Device Manager Problems,Realtek driver failure,I have the issue: Realtek driver failure — how to fix?,"Symptoms: Realtek driver failure. Sound missing, distorted, or devices not detected. Category: Audio Driver & Device Manager Problems.","Driver corruption, missing driver, or driver conflicts after update.","Open Device Manager, uninstall the audio driver and restart to let Windows reinstall it.",Download the latest audio driver from OEM website and install as administrator.,"If update caused issues, roll back driver in Device Manager to previous version.",Check Event Viewer for driver-related errors and address specific error codes.,Use OEM audio utilities to run diagnostics or firmware updates for USB sound devices.,Audio functions correctly and devices are detected; no more audio errors.,medium,Windows 11,Workstation,Realtek_driver_failure,Realtek driver failure - Audio system event logged in Event Viewer.
AUDIOV1-0610,Sound Settings & Configuration Errors,Audio enhancements causing distortion,I have the issue: Audio enhancements causing distortion — how to fix?,"Symptoms: Audio enhancements causing distortion. Sound missing, distorted, or devices not detected. Category: Sound Settings & Configuration Errors.","Incorrect device selection, muted channels, sample rate mismatch, or audio enhancements conflict.",Open Sound Settings and select the correct playback/recording device.,"Set sample rate and bit depth to a supported value (e.g., 44.1kHz or 48kHz).",Disable audio enhancements that may cause distortion.,Run Sound troubleshooter and reset sound settings if necessary.,Ensure system volume and app volumes are not muted or very low.,Audio functions correctly and devices are detected; no more audio errors.,medium,Windows 11,Tablet,Audio_enhancements_causing_distortion,Audio enhancements causing distortion - Audio system event logged in Event Viewer.
AUDIOV1-0990,OS Services & System Audio Failures,Audio service not responding,My PC shows 'Audio service not responding' and I can't hear anything.,"Symptoms: Audio service not responding. Sound missing, distorted, or devices not detected. Category: OS Services & System Audio Failures.","Windows audio services stopped, system file corruption, or interrupted updates.",Open Services.msc and ensure Windows Audio and Windows Audio Endpoint Builder services are running.,Run `sfc /scannow` and `DISM /Online /Cleanup-Image /RestoreHealth` to repair system files.,Uninstall recent audio-related Windows updates if audio broke after update.,Create a new Windows user account to rule out profile corruption affecting audio.,"If unresolved, backup data and perform a system repair or in-place upgrade.",Audio functions correctly and devices are detected; no more audio errors.,high,Windows 10,Desktop,Audio_service_not_responding,Audio service not responding - Audio system event logged in Event Viewer.
AUDIOV1-0581,Sound Settings & Configuration Errors,Sample rate mismatch,My PC shows 'Sample rate mismatch' and I can't hear anything.,"Symptoms: Sample rate mismatch. Sound missing, distorted, or devices not detected. Category: Sound Settings & Configuration Errors.","Incorrect device selection, muted channels, sample rate mismatch, or audio enhancements conflict.",Open Sound Settings and select the correct playback/recording device.,"Set sample rate and bit depth to a supported value (e.g., 44.1kHz or 48kHz).",Disable audio enhancements that may cause distortion.,Run Sound troubleshooter and reset sound settings if necessary.,Ensure system volume and app volumes are not muted or very low.,Audio functions correctly and devices are detected; no more audio errors.,medium,Windows 10,All-in-One,Sample_rate_mismatch,Sample rate mismatch - Audio system event logged in Event Viewer.
AUDIOV1-0130,Audio Output Not Working,Headphones plugged in but no sound,Problem: Headphones plugged in but no sound when using apps or calls.,"Symptoms: Headphones plugged in but no sound. Sound missing, distorted, or devices not detected. Category: Audio Output Not Working.","Missing or disabled audio device, corrupted driver, or faulty hardware.",Check the speaker icon in the taskbar; ensure not muted and correct output is selected.,"Open Device Manager → Sound, video and game controllers → scan for hardware changes.",Uninstall and reinstall audio driver; restart PC to let Windows re-detect devices.,Try alternative output (headphones/external speakers) to isolate hardware.,Run Windows Playing Audio troubleshooter (Settings → Troubleshoot → Playing Audio).,Audio functions correctly and devices are detected; no more audio errors.,high,Windows 11,Laptop,Headphones_plugged_in_but_no_sound,Headphones plugged in but no sound - Audio system event logged in Event Viewer.
