id,category,error_name,user_error_text,symptoms,cause,step_1,step_2,step_3,step_4,step_5,verification,risk,os_version,device_type,tag,log_snippet
AUDIOV1-0954,OS Services & System Audio Failures,Corrupted audio system files,Corrupted audio system files — microphone not recording properly.,"Symptoms: Corrupted audio system files. Sound missing, distorted, or devices not detected. Category: OS Services & System Audio Failures.","Windows audio services stopped, system file corruption, or interrupted updates.",Open Services.msc and ensure Windows Audio and Windows Audio Endpoint Builder services are running.,Run `sfc /scannow` and `DISM /Online /Cleanup-Image /RestoreHealth` to repair system files.,Uninstall recent audio-related Windows updates if audio broke after update.,Create a new Windows user account to rule out profile corruption affecting audio.,"If unresolved, backup data and perform a system repair or in-place upgrade.",Audio functions correctly and devices are detected; no more audio errors.,medium,Windows 10,Laptop,Corrupted_audio_system_files,Corrupted audio system files - Audio system event logged in Event Viewer.
AUDIOV1-0981,OS Services & System Audio Failures,Corrupted audio system files,Problem: Corrupted audio system files when using apps or calls.,"Symptoms: Corrupted audio system files. Sound missing, distorted, or devices not detected. Category: OS Services & System Audio Failures.","Windows audio services stopped, system file corruption, or interrupted updates.",Open Services.msc and ensure Windows Audio and Windows Audio Endpoint Builder services are running.,Run `sfc /scannow` and `DISM /Online /Cleanup-Image /RestoreHealth` to repair system files.,Uninstall recent audio-related Windows updates if audio broke after update.,Create a new Windows user account to rule out profile corruption affecting audio.,"If unresolved, backup data and perform a system repair or in-place upgrade.",Audio functions correctly and devices are detected; no more audio errors.,high,Windows 10,Workstation,Corrupted_audio_system_files,Corrupted audio system files - Audio system event logged in Event Viewer.
AUDIOV1-0497,App & Software Audio Issues,Browser audio not working,I have the issue: Browser audio not working — how to fix?,"Symptoms: Browser audio not working. Sound missing, distorted, or devices not detected. Category: App & Software Audio Issues.","App-specific settings, wrong device selection, or exclusive mode causing routing issues.",Open the app's audio settings and ensure correct output/input device is selected.,Check Windows Volume Mixer to ensure the app is not muted or set to low volume.,Disable exclusive mode in Device Properties → Advanced to allow multiple apps to use audio.,Restart the app and test with another application to determine if app-specific.,Reinstall the app if settings are corrupted or reset app preferences.,Audio functions correctly and devices are detected; no more audio errors.,medium,Windows 11,Laptop,Browser_audio_not_working,Browser audio not working - Audio system event logged in Event Viewer.
AUDIOV1-0947,OS Services & System Audio Failures,Audio service not responding,Audio service not responding — microphone not recording properly.,"Symptoms: Audio service not responding. Sound missing, distorted, or devices not detected. Category: OS Services & System Audio Failures.","Windows audio services stopped, system file corruption, or interrupted updates.",Open Services.msc and ensure Windows Audio and Windows Audio Endpoint Builder services are running.,Run `sfc /scannow` and `DISM /Online /Cleanup-Image /RestoreHealth` to repair system files.,Uninstall recent audio-related Windows updates if audio broke after update.,Create a new Windows user account to rule out profile corruption affecting audio.,"If unresolved, backup data and perform a system repair or in-place upgrade.",Audio functions correctly and devices are detected; no more audio errors.,low,Windows 11,Laptop,Audio_service_not_responding,Audio service not responding - Audio system event logged in Event Viewer.
AUDIOV1-0442,App & Software Audio Issues,Browser audio not working,I have the issue: Browser audio not working — how to fix?,"Symptoms: Browser audio not working. Sound missing, distorted, or devices not detected. Category: App & Software Audio Issues.","App-specific settings, wrong device selection, or exclusive mode causing routing issues.",Open the app's audio settings and ensure correct output/input device is selected.,Check Windows Volume Mixer to ensure the app is not muted or set to low volume.,Disable exclusive mode in Device Properties → Advanced to allow multiple apps to use audio.,Restart the app and test with another application to determine if app-specific.,Reinstall the app if settings are corrupted or reset app preferences.,Audio functions correctly and devices are detected; no more audio errors.,medium,Windows 10,All-in-One,Browser_audio_not_working,Browser audio not working - Audio system event logged in Event Viewer.
AUDIOV1-0674,Bluetooth Audio Problems,Bluetooth mic not working,My PC shows 'Bluetooth mic not working' and I can't hear anything.,"Symptoms: Bluetooth mic not working. Sound missing, distorted, or devices not detected. Category: Bluetooth Audio Problems.","Bluetooth pairing issues, codec mismatch, or low battery in headset.",Ensure Bluetooth headset is paired and set as default audio device.,Remove/forget the device and pair it again; check battery level on headset.,Update Bluetooth drivers and ensure Bluetooth service is running.,Switch codec settings if available (AAC/aptX) or use SBC as fallback.,Test headset on another device to confirm it's not a headset issue.,Audio functions correctly and devices are detected; no more audio errors.,low,Windows 10,Workstation,Bluetooth_mic_not_working,Bluetooth mic not working - Audio system event logged in Event Viewer.
AUDIOV1-0001,Audio Output Not Working,Audio cuts out randomly,Problem: Audio cuts out randomly when using apps or calls.,"Symptoms: Audio cuts out randomly. Sound missing, distorted, or devices not detected. Category: Audio Output Not Working.","Missing or disabled audio device, corrupted driver, or faulty hardware.",Check the speaker icon in the taskbar; ensure not muted and correct output is selected.,"Open Device Manager → Sound, video and game controllers → scan for hardware changes.",Uninstall and reinstall audio driver; restart PC to let Windows re-detect devices.,Try alternative output (headphones/external speakers) to isolate hardware.,Run Windows Playing Audio troubleshooter (Settings → Troubleshoot → Playing Audio).,Audio functions correctly and devices are detected; no more audio errors.,low,Windows 10,Laptop,Audio_cuts_out_randomly,Audio cuts out randomly - Audio system event logged in Event Viewer.
AUDIOV1-0561,Sound Settings & Configuration Errors,Sample rate mismatch,Sample rate mismatch — microphone not recording properly.,"Symptoms: Sample rate mismatch. Sound missing, distorted, or devices not detected. Category: Sound Settings & Configuration Errors.","Incorrect device selection, muted channels, sample rate mismatch, or audio enhancements conflict.",Open Sound Settings and select the correct playback/recording device.,"Set sample rate and bit depth to a supported value (e.g., 44.1kHz or 48kHz).",Disable audio enhancements that may cause distortion.,Run Sound troubleshooter and reset sound settings if necessary.,Ensure system volume and app volumes are not muted or very low.,Audio functions correctly and devices are detected; no more audio errors.,medium,Windows 10,Tablet,Sample_rate_mismatch,Sample rate mismatch - Audio system event logged in Event Viewer.
AUDIOV1-0771,Hardware / Port Issues,USB audio device not detected,I have the issue: USB audio device not detected — how to fix?,"Symptoms: USB audio device not detected. Sound missing, distorted, or devices not detected. Category: Hardware / Port Issues.","Physical jack/cable damage, faulty microphone or speaker hardware.",Inspect headphone jack and cables for damage; try another cable.,Test speakers/headset on another device to verify hardware works.,"For USB devices, try different USB ports and reinstall the device driver.","If connector is loose, clean port and reseat connector; consider repair if physically damaged.",Replace faulty hardware if tests confirm physical failure.,Audio functions correctly and devices are detected; no more audio errors.,medium,Windows 11,Tablet,USB_audio_device_not_detected,USB audio device not detected - Audio system event logged in Event Viewer.
AUDIOV1-0513,App & Software Audio Issues,Browser audio not working,After update I see: Browser audio not working. No sound plays.,"Symptoms: Browser audio not working. Sound missing, distorted, or devices not detected. Category: App & Software Audio Issues.","App-specific settings, wrong device selection, or exclusive mode causing routing issues.",Open the app's audio settings and ensure correct output/input device is selected.,Check Windows Volume Mixer to ensure the app is not muted or set to low volume.,Disable exclusive mode in Device Properties → Advanced to allow multiple apps to use audio.,Restart the app and test with another application to determine if app-specific.,Reinstall the app if settings are corrupted or reset app preferences.,Audio functions correctly and devices are detected; no more audio errors.,low,Windows 11,Laptop,Browser_audio_not_working,Browser audio not working - Audio system event logged in Event Viewer.
AUDIOV1-0431,App & Software Audio Issues,No sound in specific app,No sound in specific app — microphone not recording properly.,"Symptoms: No sound in specific app. Sound missing, distorted, or devices not detected. Category: App & Software Audio Issues.","App-specific settings, wrong device selection, or exclusive mode causing routing issues.",Open the app's audio settings and ensure correct output/input device is selected.,Check Windows Volume Mixer to ensure the app is not muted or set to low volume.,Disable exclusive mode in Device Properties → Advanced to allow multiple apps to use audio.,Restart the app and test with another application to determine if app-specific.,Reinstall the app if settings are corrupted or reset app preferences.,Audio functions correctly and devices are detected; no more audio errors.,medium,Windows 10,All-in-One,No_sound_in_specific_app,No sound in specific app - Audio system event logged in Event Viewer.
AUDIOV1-0905,OS Services & System Audio Failures,Corrupted audio system files,My PC shows 'Corrupted audio system files' and I can't hear anything.,"Symptoms: Corrupted audio system files. Sound missing, distorted, or devices not detected. Category: OS Services & System Audio Failures.","Windows audio services stopped, system file corruption, or interrupted updates.",Open Services.msc and ensure Windows Audio and Windows Audio Endpoint Builder services are running.,Run `sfc /scannow` and `DISM /Online /Cleanup-Image /RestoreHealth` to repair system files.,Uninstall recent audio-related Windows updates if audio broke after update.,Create a new Windows user account to rule out profile corruption affecting audio.,"If unresolved, backup data and perform a system repair or in-place upgrade.",Audio functions correctly and devices are detected; no more audio errors.,low,Windows 11,All-in-One,Corrupted_audio_system_files,Corrupted audio system files - Audio system event logged in Event Viewer.
AUDIOV1-0738,Bluetooth Audio Problems,Bluetooth headphones connected but no sound,After update I see: Bluetooth headphones connected but no sound. No sound plays.,"Symptoms: Bluetooth headphones connected but no sound. Sound missing, distorted, or devices not detected. Category: Bluetooth Audio Problems.","Bluetooth pairing issues, codec mismatch, or low battery in headset.",Ensure Bluetooth headset is paired and set as default audio device.,Remove/forget the device and pair it again; check battery level on headset.,Update Bluetooth drivers and ensure Bluetooth service is running.,Switch codec settings if available (AAC/aptX) or use SBC as fallback.,Test headset on another device to confirm it's not a headset issue.,Audio functions correctly and devices are detected; no more audio errors.,medium,Windows 10,All-in-One,Bluetooth_headphones_connected_but_no_sound,Bluetooth headphones connected but no sound - Audio system event logged in Event Viewer.
AUDIOV1-0910,OS Services & System Audio Failures,After update no sound,After update no sound — microphone not recording properly.,"Symptoms: After update no sound. Sound missing, distorted, or devices not detected. Category: OS Services & System Audio Failures.","Windows audio services stopped, system file corruption, or interrupted updates.",Open Services.msc and ensure Windows Audio and Windows Audio Endpoint Builder services are running.,Run `sfc /scannow` and `DISM /Online /Cleanup-Image /RestoreHealth` to repair system files.,Uninstall recent audio-related Windows updates if audio broke after update.,Create a new Windows user account to rule out profile corruption affecting audio.,"If unresolved, backup data and perform a system repair or in-place upgrade.",Audio functions correctly and devices are detected; no more audio errors.,high,Windows 11,Workstation,After_update_no_sound,After update no sound - Audio system event logged in Event Viewer.
AUDIOV1-0299,Audio Driver & Device Manager Problems,Driver rollback error,My PC shows 'Driver rollback error' and I can't hear anything.,"Symptoms: Driver rollback error. Sound missing, distorted, or devices not detected. Category: Audio Driver & Device Manager Problems.","Driver corruption, missing driver, or driver conflicts after update.","Open Device Manager, uninstall the audio driver and restart to let Windows reinstall it.",Download the latest audio driver from OEM website and install as administrator.,"If update caused issues, roll back driver in Device Manager to previous version.",Check Event Viewer for driver-related errors and address specific error codes.,Use OEM audio utilities to run diagnostics or firmware updates for USB sound devices.,Audio functions correctly and devices are detected; no more audio errors.,medium,Windows 10,Workstation,Driver_rollback_error,Driver rollback error - Audio system event logged in Event Viewer.
AUDIOV1-0415,App & Software Audio Issues,Wrong output device selected,My PC shows 'Wrong output device selected' and I can't hear anything.,"Symptoms: Wrong output device selected. Sound missing, distorted, or devices not detected. Category: App & Software Audio Issues.","App-specific settings, wrong device selection, or exclusive mode causing routing issues.",Open the app's audio settings and ensure correct output/input device is selected.,Check Windows Volume Mixer to ensure the app is not muted or set to low volume.,Disable exclusive mode in Device Properties → Advanced to allow multiple apps to use audio.,Restart the app and test with another application to determine if app-specific.,Reinstall the app if settings are corrupted or reset app preferences.,Audio functions correctly and devices are detected; no more audio errors.,high,Windows 10,All-in-One,Wrong_output_device_selected,Wrong output device selected - Audio system event logged in Event Viewer.
AUDIOV1-0693,Bluetooth Audio Problems,Bluetooth mic not working,My PC shows 'Bluetooth mic not working' and I can't hear anything.,"Symptoms: Bluetooth mic not working. Sound missing, distorted, or devices not detected. Category: Bluetooth Audio Problems.","Bluetooth pairing issues, codec mismatch, or low battery in headset.",Ensure Bluetooth headset is paired and set as default audio device.,Remove/forget the device and pair it again; check battery level on headset.,Update Bluetooth drivers and ensure Bluetooth service is running.,Switch codec settings if available (AAC/aptX) or use SBC as fallback.,Test headset on another device to confirm it's not a headset issue.,Audio functions correctly and devices are detected; no more audio errors.,medium,Windows 11,Desktop,Bluetooth_mic_not_working,Bluetooth mic not working - Audio system event logged in Event Viewer.
AUDIOV1-0701,Bluetooth Audio Problems,Frequent disconnections,Problem: Frequent disconnections when using apps or calls.,"Symptoms: Frequent disconnections. Sound missing, distorted, or devices not detected. Category: Bluetooth Audio Problems.","Bluetooth pairing issues, codec mismatch, or low battery in headset.",Ensure Bluetooth headset is paired and set as default audio device.,Remove/forget the device and pair it again; check battery level on headset.,Update Bluetooth drivers and ensure Bluetooth service is running.,Switch codec settings if available (AAC/aptX) or use SBC as fallback.,Test headset on another device to confirm it's not a headset issue.,Audio functions correctly and devices are detected; no more audio errors.,high,Windows 11,All-in-One,Frequent_disconnections,Frequent disconnections - Audio system event logged in Event Viewer.
AUDIOV1-0575,Sound Settings & Configuration Errors,Audio enhancements causing distortion,My PC shows 'Audio enhancements causing distortion' and I can't hear anything.,"Symptoms: Audio enhancements causing distortion. Sound missing, distorted, or devices not detected. Category: Sound Settings & Configuration Errors.","Incorrect device selection, muted channels, sample rate mismatch, or audio enhancements conflict.",Open Sound Settings and select the correct playback/recording device.,"Set sample rate and bit depth to a supported value (e.g., 44.1kHz or 48kHz).",Disable audio enhancements that may cause distortion.,Run Sound troubleshooter and reset sound settings if necessary.,Ensure system volume and app volumes are not muted or very low.,Audio functions correctly and devices are detected; no more audio errors.,low,Windows 11,Desktop,Audio_enhancements_causing_distortion,Audio enhancements causing distortion - Audio system event logged in Event Viewer.
AUDIOV1-0676,Bluetooth Audio Problems,Bluetooth mic not working,Problem: Bluetooth mic not working when using apps or calls.,"Symptoms: Bluetooth mic not working. Sound missing, distorted, or devices not detected. Category: Bluetooth Audio Problems.","Bluetooth pairing issues, codec mismatch, or low battery in headset.",Ensure Bluetooth headset is paired and set as default audio device.,Remove/forget the device and pair it again; check battery level on headset.,Update Bluetooth drivers and ensure Bluetooth service is running.,Switch codec settings if available (AAC/aptX) or use SBC as fallback.,Test headset on another device to confirm it's not a headset issue.,Audio functions correctly and devices are detected; no more audio errors.,medium,Windows 11,Workstation,Bluetooth_mic_not_working,Bluetooth mic not working - Audio system event logged in Event Viewer.
AUDIOV1-0536,Sound Settings & Configuration Errors,Wrong playback device,Problem: Wrong playback device when using apps or calls.,"Symptoms: Wrong playback device. Sound missing, distorted, or devices not detected. Category: Sound Settings & Configuration Errors.","Incorrect device selection, muted channels, sample rate mismatch, or audio enhancements conflict.",Open Sound Settings and select the correct playback/recording device.,"Set sample rate and bit depth to a supported value (e.g., 44.1kHz or 48kHz).",Disable audio enhancements that may cause distortion.,Run Sound troubleshooter and reset sound settings if necessary.,Ensure system volume and app volumes are not muted or very low.,Audio functions correctly and devices are detected; no more audio errors.,high,Windows 11,Desktop,Wrong_playback_device,Wrong playback device - Audio system event logged in Event Viewer.
AUDIOV1-0642,Sound Settings & Configuration Errors,Spatial Sound issues,Spatial Sound issues — microphone not recording properly.,"Symptoms: Spatial Sound issues. Sound missing, distorted, or devices not detected. Category: Sound Settings & Configuration Errors.","Incorrect device selection, muted channels, sample rate mismatch, or audio enhancements conflict.",Open Sound Settings and select the correct playback/recording device.,"Set sample rate and bit depth to a supported value (e.g., 44.1kHz or 48kHz).",Disable audio enhancements that may cause distortion.,Run Sound troubleshooter and reset sound settings if necessary.,Ensure system volume and app volumes are not muted or very low.,Audio functions correctly and devices are detected; no more audio errors.,high,Windows 10,Workstation,Spatial_Sound_issues,Spatial Sound issues - Audio system event logged in Event Viewer.
AUDIOV1-0632,Sound Settings & Configuration Errors,Muted system volume,I have the issue: Muted system volume — how to fix?,"Symptoms: Muted system volume. Sound missing, distorted, or devices not detected. Category: Sound Settings & Configuration Errors.","Incorrect device selection, muted channels, sample rate mismatch, or audio enhancements conflict.",Open Sound Settings and select the correct playback/recording device.,"Set sample rate and bit depth to a supported value (e.g., 44.1kHz or 48kHz).",Disable audio enhancements that may cause distortion.,Run Sound troubleshooter and reset sound settings if necessary.,Ensure system volume and app volumes are not muted or very low.,Audio functions correctly and devices are detected; no more audio errors.,medium,Windows 11,Laptop,Muted_system_volume,Muted system volume - Audio system event logged in Event Viewer.
AUDIOV1-0774,Hardware / Port Issues,USB audio device not detected,After update I see: USB audio device not detected. No sound plays.,"Symptoms: USB audio device not detected. Sound missing, distorted, or devices not detected. Category: Hardware / Port Issues.","Physical jack/cable damage, faulty microphone or speaker hardware.",Inspect headphone jack and cables for damage; try another cable.,Test speakers/headset on another device to verify hardware works.,"For USB devices, try different USB ports and reinstall the device driver.","If connector is loose, clean port and reseat connector; consider repair if physically damaged.",Replace faulty hardware if tests confirm physical failure.,Audio functions correctly and devices are detected; no more audio errors.,low,Windows 11,Laptop,USB_audio_device_not_detected,USB audio device not detected - Audio system event logged in Event Viewer.
AUDIOV1-0419,App & Software Audio Issues,Browser audio not working,Problem: Browser audio not working when using apps or calls.,"Symptoms: Browser audio not working. Sound missing, distorted, or devices not detected. Category: App & Software Audio Issues.","App-specific settings, wrong device selection, or exclusive mode causing routing issues.",Open the app's audio settings and ensure correct output/input device is selected.,Check Windows Volume Mixer to ensure the app is not muted or set to low volume.,Disable exclusive mode in Device Properties → Advanced to allow multiple apps to use audio.,Restart the app and test with another application to determine if app-specific.,Reinstall the app if settings are corrupted or reset app preferences.,Audio functions correctly and devices are detected; no more audio errors.,low,Windows 10,Workstation,Browser_audio_not_working,Browser audio not working - Audio system event logged in Event Viewer.
AUDIOV1-0272,Audio Driver & Device Manager Problems,Device Manager warning on sound drivers,I have the issue: Device Manager warning on sound drivers — how to fix?,"Symptoms: Device Manager warning on sound drivers. Sound missing, distorted, or devices not detected. Category: Audio Driver & Device Manager Problems.","Driver corruption, missing driver, or driver conflicts after update.","Open Device Manager, uninstall the audio driver and restart to let Windows reinstall it.",Download the latest audio driver from OEM website and install as administrator.,"If update caused issues, roll back driver in Device Manager to previous version.",Check Event Viewer for driver-related errors and address specific error codes.,Use OEM audio utilities to run diagnostics or firmware updates for USB sound devices.,Audio functions correctly and devices are detected; no more audio errors.,low,Windows 10,Workstation,Device_Manager_warning_on_sound_drivers,Device Manager warning on sound drivers - Audio system event logged in Event Viewer.
AUDIOV1-0120,Audio Output Not Working,No audio output,After update I see: No audio output. No sound plays.,"Symptoms: No audio output. Sound missing, distorted, or devices not detected. Category: Audio Output Not Working.","Missing or disabled audio device, corrupted driver, or faulty hardware.",Check the speaker icon in the taskbar; ensure not muted and correct output is selected.,"Open Device Manager → Sound, video and game controllers → scan for hardware changes.",Uninstall and reinstall audio driver; restart PC to let Windows re-detect devices.,Try alternative output (headphones/external speakers) to isolate hardware.,Run Windows Playing Audio troubleshooter (Settings → Troubleshoot → Playing Audio).,Audio functions correctly and devices are detected; no more audio errors.,medium,Windows 11,Desktop,No_audio_output,No audio output - Audio system event logged in Event Viewer.
