user_text,component_label,source
laptop usb connection issue,USB / Port Issue,auto_corrected_from_test
PC slow boot,SSD Upgrade,auto_corrected_from_test
pc usb port not working,USB / Port Issue,auto_corrected_from_test
phone not showing please,Phone Connection Issue,auto_corrected_from_test
WiFi connected no internet plus USB not detected,Wi-Fi Adapter Upgrade,auto_corrected_from_test
Processor fan loud and PC slow performance,CPU Overheat,auto_corrected_from_test
pc usb port not working,USB / Port Issue,auto_corrected_from_test
the processor too hot,CPU Overheat,auto_corrected_from_test
computer pc not start after update,Windows Boot Failure,auto_corrected_from_test
internet not working,Wi-Fi Adapter Upgrade,auto_corrected_from_test
no power at all issue,PSU / Power Issue,auto_corrected_from_test
pc not boot problem,Windows Boot Failure,auto_corrected_from_test
pc very slow issue,Slow Performance,auto_corrected_from_test
pc graphics card fan loud,GPU Overheat,auto_corrected_from_test
"BSOD error, Windows not starting",Blue Screen (BSOD),auto_corrected_from_test
pc not start after update,Windows Boot Failure,auto_corrected_from_test
my computer slow,Slow Performance,auto_corrected_from_test
the power button not working,PSU / Power Issue,auto_corrected_from_test
fix pc no display vga,No Display / No Signal,auto_corrected_from_test
pc something wrong pc,General Repair,auto_corrected_from_test
pc slow after update problem,Slow Performance,auto_corrected_from_test
internet slow only pc,Wi-Fi Adapter Upgrade,auto_corrected_from_test
the phone not connecting,Phone Connection Issue,auto_corrected_from_test
GPU fan not working plus PC slow performance,GPU Overheat,auto_corrected_from_test
Windows error screen and PC stuck on logo,Blue Screen (BSOD),auto_corrected_from_test
PC no signal plus Need better graphics card,No Display / No Signal,auto_corrected_from_test
pc stuck startup repair problem,Windows Boot Failure,auto_corrected_from_test
help usb not detected,USB / Port Issue,auto_corrected_from_test
computer monitor no signal,No Display / No Signal,auto_corrected_from_test
computer memory upgrade needed,RAM Upgrade,auto_corrected_from_test
computer pc on blank screen,No Display / No Signal,auto_corrected_from_test
PC slow loading programs plus PC not start after update,SSD Upgrade,auto_corrected_from_test
pc internet not working,Wi-Fi Adapter Upgrade,auto_corrected_from_test
PC not start after update,Windows Boot Failure,auto_corrected_from_test
my pc stuck on logo,Windows Boot Failure,auto_corrected_from_test
wifi connected no internet please,Wi-Fi Adapter Upgrade,auto_corrected_from_test
pc slow boot please,SSD Upgrade,auto_corrected_from_test
computer usb port not working,USB / Port Issue,auto_corrected_from_test
help laptop error screen,Blue Screen (BSOD),auto_corrected_from_test
laptop something wrong pc,General Repair,auto_corrected_from_test
fix screen black pc on,No Display / No Signal,auto_corrected_from_test
boot failure problem,Windows Boot Failure,auto_corrected_from_test
pc pc start only sometimes,PSU / Power Issue,auto_corrected_from_test
phone connection problem problem,Phone Connection Issue,auto_corrected_from_test
usb not detected,USB / Port Issue,auto_corrected_from_test
pc not turning on,PSU / Power Issue,auto_corrected_from_test
pc pc problem unknown,General Repair,auto_corrected_from_test
computer phone connection problem,Phone Connection Issue,auto_corrected_from_test
Monitor no signal and Graphics card upgrade needed,No Display / No Signal,auto_corrected_from_test
Processor thermal throttle PC very slow RAM performance issue,CPU Overheat,auto_corrected_from_test
computer port not working,USB / Port Issue,auto_corrected_from_test
Boot failure,Windows Boot Failure,auto_corrected_from_test
the pc not turning on,PSU / Power Issue,auto_corrected_from_test
GPU hot when gaming PC very unresponsive,GPU Overheat,auto_corrected_from_test
fix pc lag always,Slow Performance,auto_corrected_from_test
pc no signal display issue,No Display / No Signal,auto_corrected_from_test
pc issue problem,General Repair,auto_corrected_from_test
usb cable issue please,USB / Port Issue,auto_corrected_from_test
WiFi connected no internet plus USB cable issue,Wi-Fi Adapter Upgrade,auto_corrected_from_test
the phone connection problem,Phone Connection Issue,auto_corrected_from_test
help laptop charging light blink,PSU / Power Issue,auto_corrected_from_test
GPU temperature high also Computer slow,GPU Overheat,auto_corrected_from_test
help gpu overheat warning,GPU Overheat,auto_corrected_from_test
System sluggish,Slow Performance,auto_corrected_from_test
Phone connection problem,Phone Connection Issue,auto_corrected_from_test
the usb cable issue,USB / Port Issue,auto_corrected_from_test
my pc problem unknown,General Repair,auto_corrected_from_test
PC slow boot PC stuck startup repair,SSD Upgrade,auto_corrected_from_test
pc start then off,PSU / Power Issue,auto_corrected_from_test
Phone not detected,Phone Connection Issue,auto_corrected_from_test
Monitor not detected and GPU bottleneck,No Display / No Signal,auto_corrected_from_test
"SSD not fast enough, PC not start after update",SSD Upgrade,auto_corrected_from_test
the pc stuck bios,Windows Boot Failure,auto_corrected_from_test
laptop pc slow boot,SSD Upgrade,auto_corrected_from_test
phone not showing issue,Phone Connection Issue,auto_corrected_from_test
Processor thermal throttle also System slow overall,CPU Overheat,auto_corrected_from_test
"PC no display HDMI, Graphics not good enough",No Display / No Signal,auto_corrected_from_test
the system slow,Slow Performance,auto_corrected_from_test
pc slow opening files issue,SSD Upgrade,auto_corrected_from_test
"Processor thermal throttle, System sluggish, Need more memory",CPU Overheat,auto_corrected_from_test
laptop pc can't connect wifi,Wi-Fi Adapter Upgrade,auto_corrected_from_test
"CPU overheating, PC lag always, RAM not enough",CPU Overheat,auto_corrected_from_test
help pc stuck on logo,Windows Boot Failure,auto_corrected_from_test
pc internet not working,Wi-Fi Adapter Upgrade,auto_corrected_from_test
computer pc slow after update,Slow Performance,auto_corrected_from_test
help pc no display hdmi,No Display / No Signal,auto_corrected_from_test
processor fan loud,CPU Overheat,auto_corrected_from_test
computer wifi connected no internet,Wi-Fi Adapter Upgrade,auto_corrected_from_test
computer internet not working,Wi-Fi Adapter Upgrade,auto_corrected_from_test
laptop pc very slow,Slow Performance,auto_corrected_from_test
pc pc beep sound,RAM Upgrade,auto_corrected_from_test
computer usb not detected,USB / Port Issue,auto_corrected_from_test
PC very unresponsive,Slow Performance,auto_corrected_from_test
system slow overall issue,Slow Performance,auto_corrected_from_test
Blue screen of death and PC not start after update,Blue Screen (BSOD),auto_corrected_from_test
pc pc issue,General Repair,auto_corrected_from_test
gpu hot when gaming,GPU Overheat,auto_corrected_from_test
WiFi disconnect always,Wi-Fi Adapter Upgrade,auto_corrected_from_test
laptop pc not working,General Repair,auto_corrected_from_test
CPU hot always also Computer slow,CPU Overheat,auto_corrected_from_test
my no display,No Display / No Signal,auto_corrected_from_test
pc no display vga issue,No Display / No Signal,auto_corrected_from_test
fix port not working,USB / Port Issue,auto_corrected_from_test
system slow,Slow Performance,auto_corrected_from_test
pc not turning on issue,PSU / Power Issue,auto_corrected_from_test
pc slow loading programs,SSD Upgrade,auto_corrected_from_test
system sluggish,Slow Performance,auto_corrected_from_test
my system slow overall,Slow Performance,auto_corrected_from_test
pc stuck loading please,Windows Boot Failure,auto_corrected_from_test
wifi connected no internet please,Wi-Fi Adapter Upgrade,auto_corrected_from_test
the computer slow,Slow Performance,auto_corrected_from_test
pc pc problem unknown,General Repair,auto_corrected_from_test
my boot failure,Windows Boot Failure,auto_corrected_from_test
PC slow loading programs and Windows not starting,SSD Upgrade,auto_corrected_from_test
help screen black pc on,No Display / No Signal,auto_corrected_from_test
help usb not working,USB / Port Issue,auto_corrected_from_test
"Monitor no signal, Graphics card upgrade needed",No Display / No Signal,auto_corrected_from_test
Monitor no signal plus Need better graphics card,No Display / No Signal,auto_corrected_from_test
No display plus Game lag graphics,No Display / No Signal,auto_corrected_from_test
PC slow after update,Slow Performance,auto_corrected_from_test
the cpu hot always,CPU Overheat,auto_corrected_from_test
GPU temperature high Computer slow,GPU Overheat,auto_corrected_from_test
PC slow loading programs and PC stuck on logo,SSD Upgrade,auto_corrected_from_test
processor overheating issue,CPU Overheat,auto_corrected_from_test
usb device not recognized problem,USB / Port Issue,auto_corrected_from_test
PC no display HDMI,No Display / No Signal,auto_corrected_from_test
"CPU thermal issue, System slow overall, RAM performance issue",CPU Overheat,auto_corrected_from_test
memory upgrade needed please,RAM Upgrade,auto_corrected_from_test
"PC slow loading programs, PC stuck BIOS",SSD Upgrade,auto_corrected_from_test
pc can't connect wifi,Wi-Fi Adapter Upgrade,auto_corrected_from_test
PC no signal plus Low FPS problem,No Display / No Signal,auto_corrected_from_test
gpu shutdown due to heat issue,GPU Overheat,auto_corrected_from_test
pc beep sound please,RAM Upgrade,auto_corrected_from_test
laptop pc issue,General Repair,auto_corrected_from_test
help pc stuck loading,Windows Boot Failure,auto_corrected_from_test
usb port damaged please,USB / Port Issue,auto_corrected_from_test
fix pc stuck loading,Windows Boot Failure,auto_corrected_from_test
pc malfunction issue,General Repair,auto_corrected_from_test
pc slow after update please,Slow Performance,auto_corrected_from_test
"PC on blank screen, Game lag graphics",No Display / No Signal,auto_corrected_from_test
fix system slow,Slow Performance,auto_corrected_from_test
gpu thermal issue,GPU Overheat,auto_corrected_from_test
help processor overheating,CPU Overheat,auto_corrected_from_test
pc very unresponsive problem,Slow Performance,auto_corrected_from_test
laptop system slow,Slow Performance,auto_corrected_from_test
no internet on pc,Wi-Fi Adapter Upgrade,auto_corrected_from_test
fix no display,No Display / No Signal,auto_corrected_from_test
"No display, GPU performance issue",No Display / No Signal,auto_corrected_from_test
computer no internet on pc,Wi-Fi Adapter Upgrade,auto_corrected_from_test
pc stuck startup repair problem,Windows Boot Failure,auto_corrected_from_test
computer something wrong pc,General Repair,auto_corrected_from_test
computer phone not showing,Phone Connection Issue,auto_corrected_from_test
"PC shutdown suddenly, PC not start after update",PSU / Power Issue,auto_corrected_from_test
laptop pc not turning on,PSU / Power Issue,auto_corrected_from_test
help pc slow opening files,SSD Upgrade,auto_corrected_from_test
PC lag always,Slow Performance,auto_corrected_from_test
computer pc shutdown suddenly,PSU / Power Issue,auto_corrected_from_test
pc not turning on please,PSU / Power Issue,auto_corrected_from_test
computer phone usb issue,Phone Connection Issue,auto_corrected_from_test
my pc beep sound,RAM Upgrade,auto_corrected_from_test
boot failure problem,Windows Boot Failure,auto_corrected_from_test
laptop boot failure,Windows Boot Failure,auto_corrected_from_test
the usb not working,USB / Port Issue,auto_corrected_from_test
port not working problem,USB / Port Issue,auto_corrected_from_test
the pc beep sound,RAM Upgrade,auto_corrected_from_test
the pc stuck startup repair,Windows Boot Failure,auto_corrected_from_test
the pc beep sound,RAM Upgrade,auto_corrected_from_test
laptop pc can't connect wifi,Wi-Fi Adapter Upgrade,auto_corrected_from_test
help usb not detected,USB / Port Issue,auto_corrected_from_test
fix gpu overheating during games,GPU Overheat,auto_corrected_from_test
usb port broken problem,USB / Port Issue,auto_corrected_from_test
PC on blank screen,No Display / No Signal,auto_corrected_from_test
usb device not recognized problem,USB / Port Issue,auto_corrected_from_test
pc stuck bios please,Windows Boot Failure,auto_corrected_from_test
Processor too hot and PC lag always and RAM outdated,CPU Overheat,auto_corrected_from_test
help pc slow loading programs,SSD Upgrade,auto_corrected_from_test
phone usb issue please,Phone Connection Issue,auto_corrected_from_test
fix processor overheating,CPU Overheat,auto_corrected_from_test
pc phone not connecting,Phone Connection Issue,auto_corrected_from_test
my internet slow only pc,Wi-Fi Adapter Upgrade,auto_corrected_from_test
pc slow boot problem,SSD Upgrade,auto_corrected_from_test
PC slow loading programs also Windows not starting,SSD Upgrade,auto_corrected_from_test
pc very unresponsive problem,Slow Performance,auto_corrected_from_test
computer pc slow boot,SSD Upgrade,auto_corrected_from_test
pc stuck on logo,Windows Boot Failure,auto_corrected_from_test
help pc not detect wifi,Wi-Fi Adapter Upgrade,auto_corrected_from_test
PC slow loading programs plus PC stuck loading,SSD Upgrade,auto_corrected_from_test
help pc stuck on logo,Windows Boot Failure,auto_corrected_from_test
pc computer problem,General Repair,auto_corrected_from_test
PC no display VGA,No Display / No Signal,auto_corrected_from_test
PC start only sometimes,PSU / Power Issue,auto_corrected_from_test
No display,No Display / No Signal,auto_corrected_from_test
computer slow,Slow Performance,auto_corrected_from_test
pc start then off issue,PSU / Power Issue,auto_corrected_from_test
pc very slow,Slow Performance,auto_corrected_from_test
usb cable issue please,USB / Port Issue,auto_corrected_from_test
pc start then off problem,PSU / Power Issue,auto_corrected_from_test
pc usb port damaged,USB / Port Issue,auto_corrected_from_test
help bsod error,Blue Screen (BSOD),auto_corrected_from_test
power button not working problem,PSU / Power Issue,auto_corrected_from_test
pc slow opening files,SSD Upgrade,auto_corrected_from_test
help no internet on pc,Wi-Fi Adapter Upgrade,auto_corrected_from_test
help pc slow boot,SSD Upgrade,auto_corrected_from_test
pc start then off issue,PSU / Power Issue,auto_corrected_from_test
Power button not working,PSU / Power Issue,auto_corrected_from_test
computer something wrong pc,General Repair,auto_corrected_from_test
my usb device not recognized,USB / Port Issue,auto_corrected_from_test
pc gpu overheat warning,GPU Overheat,auto_corrected_from_test
Screen black PC on GPU bottleneck,No Display / No Signal,auto_corrected_from_test
processor overheating problem,CPU Overheat,auto_corrected_from_test
Windows error screen also Computer stuck booting,Blue Screen (BSOD),auto_corrected_from_test
the boot failure,Windows Boot Failure,auto_corrected_from_test
processor overheating problem,CPU Overheat,auto_corrected_from_test
fix pc can't connect wifi,Wi-Fi Adapter Upgrade,auto_corrected_from_test
pc cpu fan not spinning,CPU Overheat,auto_corrected_from_test
wifi not working,Wi-Fi Adapter Upgrade,auto_corrected_from_test
No internet on PC plus Port not working,Wi-Fi Adapter Upgrade,auto_corrected_from_test
laptop pc stuck on logo,Windows Boot Failure,auto_corrected_from_test
help no power at all,PSU / Power Issue,auto_corrected_from_test
computer gpu hot when gaming,GPU Overheat,auto_corrected_from_test
the internet not working,Wi-Fi Adapter Upgrade,auto_corrected_from_test
computer phone not showing,Phone Connection Issue,auto_corrected_from_test
laptop pc slow boot,SSD Upgrade,auto_corrected_from_test
the port not working,USB / Port Issue,auto_corrected_from_test
Screen black PC on GPU bottleneck,No Display / No Signal,auto_corrected_from_test
laptop pc very slow,Slow Performance,auto_corrected_from_test
computer usb port broken,USB / Port Issue,auto_corrected_from_test
USB port not working,USB / Port Issue,auto_corrected_from_test
Something wrong PC,General Repair,auto_corrected_from_test
my pc not start after update,Windows Boot Failure,auto_corrected_from_test
system slow overall please,Slow Performance,auto_corrected_from_test
pc pc issue,General Repair,auto_corrected_from_test
pc not working issue,General Repair,auto_corrected_from_test
computer problem please,General Repair,auto_corrected_from_test
fix pc malfunction,General Repair,auto_corrected_from_test
laptop phone not connecting,Phone Connection Issue,auto_corrected_from_test
computer pc slow loading programs,SSD Upgrade,auto_corrected_from_test
the pc slow opening files,SSD Upgrade,auto_corrected_from_test
computer pc slow opening files,SSD Upgrade,auto_corrected_from_test
usb port broken,USB / Port Issue,auto_corrected_from_test
fix pc dead after power cut,PSU / Power Issue,auto_corrected_from_test
pc cpu fan not spinning,CPU Overheat,auto_corrected_from_test
laptop pc not detect wifi,Wi-Fi Adapter Upgrade,auto_corrected_from_test
wifi connected no internet issue,Wi-Fi Adapter Upgrade,auto_corrected_from_test
my pc lag always,Slow Performance,auto_corrected_from_test
memory upgrade needed please,RAM Upgrade,auto_corrected_from_test
laptop system slow overall,Slow Performance,auto_corrected_from_test
PC no signal display and Graphics card not detect,No Display / No Signal,auto_corrected_from_test
pc phone not recognized,Phone Connection Issue,auto_corrected_from_test
Memory upgrade needed,RAM Upgrade,auto_corrected_from_test
my phone not showing,Phone Connection Issue,auto_corrected_from_test
phone not connecting please,Phone Connection Issue,auto_corrected_from_test
PC problem unknown,General Repair,auto_corrected_from_test
fix internet slow only pc,Wi-Fi Adapter Upgrade,auto_corrected_from_test
pc slow performance issue,Slow Performance,auto_corrected_from_test
the pc slow boot,SSD Upgrade,auto_corrected_from_test
wifi very slow pc,Wi-Fi Adapter Upgrade,auto_corrected_from_test
the computer problem,General Repair,auto_corrected_from_test
my usb port not working,USB / Port Issue,auto_corrected_from_test
pc no signal display please,No Display / No Signal,auto_corrected_from_test
pc stuck on logo issue,Windows Boot Failure,auto_corrected_from_test
pc stuck bios please,Windows Boot Failure,auto_corrected_from_test
computer phone not detected,Phone Connection Issue,auto_corrected_from_test
laptop something wrong pc,General Repair,auto_corrected_from_test
fix usb device not recognized,USB / Port Issue,auto_corrected_from_test
laptop graphics card overheating,GPU Overheat,auto_corrected_from_test
pc issue issue,General Repair,auto_corrected_from_test
help cpu fan not spinning,CPU Overheat,auto_corrected_from_test
computer wifi not working,Wi-Fi Adapter Upgrade,auto_corrected_from_test
screen black pc on issue,No Display / No Signal,auto_corrected_from_test
CPU cooling problem PC very slow,CPU Overheat,auto_corrected_from_test
fix pc very slow,Slow Performance,auto_corrected_from_test
the pc issue,General Repair,auto_corrected_from_test
PC slow boot also Windows not starting,SSD Upgrade,auto_corrected_from_test
pc slow boot problem,SSD Upgrade,auto_corrected_from_test
fix phone not recognized,Phone Connection Issue,auto_corrected_from_test
computer pc dead after power cut,PSU / Power Issue,auto_corrected_from_test
Windows crash suddenly also PC stuck on logo,Blue Screen (BSOD),auto_corrected_from_test
monitor not detected,No Display / No Signal,auto_corrected_from_test
the pc stuck loading,Windows Boot Failure,auto_corrected_from_test
CPU overheating PC slow after update PC beep sound,CPU Overheat,auto_corrected_from_test
Need faster storage also PC not start after update,SSD Upgrade,auto_corrected_from_test
the pc slow opening files,SSD Upgrade,auto_corrected_from_test
"Monitor not detected, Need better graphics card",No Display / No Signal,auto_corrected_from_test
Processor too hot plus PC very slow,CPU Overheat,auto_corrected_from_test
laptop pc stuck on logo,Windows Boot Failure,auto_corrected_from_test
pc usb cable issue,USB / Port Issue,auto_corrected_from_test
boot failure issue,Windows Boot Failure,auto_corrected_from_test
pc phone usb issue,Phone Connection Issue,auto_corrected_from_test
bsod error problem,Blue Screen (BSOD),auto_corrected_from_test
help windows not starting,Windows Boot Failure,auto_corrected_from_test
cpu thermal issue please,CPU Overheat,auto_corrected_from_test
my boot failure,Windows Boot Failure,auto_corrected_from_test
help pc malfunction,General Repair,auto_corrected_from_test
laptop pc slow boot,SSD Upgrade,auto_corrected_from_test
PC not detect WiFi also USB connection issue,Wi-Fi Adapter Upgrade,auto_corrected_from_test
"PC no display HDMI, Low FPS problem",No Display / No Signal,auto_corrected_from_test
USB not detected,USB / Port Issue,auto_corrected_from_test
"PC shutdown suddenly, PC not start after update",PSU / Power Issue,auto_corrected_from_test
boot failure problem,Windows Boot Failure,auto_corrected_from_test
PC slow after update,Slow Performance,auto_corrected_from_test
phone connection problem issue,Phone Connection Issue,auto_corrected_from_test
pc slow opening files issue,SSD Upgrade,auto_corrected_from_test
fix processor too hot,CPU Overheat,auto_corrected_from_test
pc pc lag always,Slow Performance,auto_corrected_from_test
usb port broken please,USB / Port Issue,auto_corrected_from_test
pc shutdown suddenly issue,PSU / Power Issue,auto_corrected_from_test
computer usb device not recognized,USB / Port Issue,auto_corrected_from_test
Internet not working,Wi-Fi Adapter Upgrade,auto_corrected_from_test
Phone not recognized,Phone Connection Issue,auto_corrected_from_test
memory upgrade needed,RAM Upgrade,auto_corrected_from_test
fix usb port not working,USB / Port Issue,auto_corrected_from_test
pc pc issue,General Repair,auto_corrected_from_test
Boot failure,Windows Boot Failure,auto_corrected_from_test
WiFi connected no internet USB device not recognized,Wi-Fi Adapter Upgrade,auto_corrected_from_test
PC slow opening files and Computer stuck booting,SSD Upgrade,auto_corrected_from_test
computer computer stuck booting,Windows Boot Failure,auto_corrected_from_test
the phone connection problem,Phone Connection Issue,auto_corrected_from_test
CPU overheating plus Computer slow,CPU Overheat,auto_corrected_from_test
Processor overheating PC slow after update Need more RAM,CPU Overheat,auto_corrected_from_test
gpu overheat warning please,GPU Overheat,auto_corrected_from_test
the no internet on pc,Wi-Fi Adapter Upgrade,auto_corrected_from_test
Internet slow only PC,Wi-Fi Adapter Upgrade,auto_corrected_from_test
the wifi disconnect always,Wi-Fi Adapter Upgrade,auto_corrected_from_test
laptop pc very unresponsive,Slow Performance,auto_corrected_from_test
"Graphics card too hot, Computer slow",GPU Overheat,auto_corrected_from_test
computer no display,No Display / No Signal,auto_corrected_from_test
pc start only sometimes issue,PSU / Power Issue,auto_corrected_from_test
pc port not working,USB / Port Issue,auto_corrected_from_test
the computer problem,General Repair,auto_corrected_from_test
Graphics card overheating PC slow after update,GPU Overheat,auto_corrected_from_test
the something wrong pc,General Repair,auto_corrected_from_test
the wifi disconnect always,Wi-Fi Adapter Upgrade,auto_corrected_from_test
PC start only sometimes,PSU / Power Issue,auto_corrected_from_test
Processor overheating,CPU Overheat,auto_corrected_from_test
usb connection issue,USB / Port Issue,auto_corrected_from_test
computer pc slow opening files,SSD Upgrade,auto_corrected_from_test
Phone not recognized,Phone Connection Issue,auto_corrected_from_test
my internet not working,Wi-Fi Adapter Upgrade,auto_corrected_from_test
Processor thermal throttle PC slow after update,CPU Overheat,auto_corrected_from_test
pc malfunction,General Repair,auto_corrected_from_test
No power at all,PSU / Power Issue,auto_corrected_from_test
my gpu shutdown due to heat,GPU Overheat,auto_corrected_from_test
computer pc not detect wifi,Wi-Fi Adapter Upgrade,auto_corrected_from_test
pc stuck loading please,Windows Boot Failure,auto_corrected_from_test
computer phone not detected,Phone Connection Issue,auto_corrected_from_test
pc pc start then off,PSU / Power Issue,auto_corrected_from_test
pc gpu hot when gaming,GPU Overheat,auto_corrected_from_test
pc cpu fan not spinning,CPU Overheat,auto_corrected_from_test
Graphics card fan loud PC very unresponsive,GPU Overheat,auto_corrected_from_test
laptop computer slow,Slow Performance,auto_corrected_from_test
my wifi not working,Wi-Fi Adapter Upgrade,auto_corrected_from_test
CPU hot always and Computer slow and Memory insufficient,CPU Overheat,auto_corrected_from_test
PC on blank screen and GPU bottleneck,No Display / No Signal,auto_corrected_from_test
pc wifi very slow pc,Wi-Fi Adapter Upgrade,auto_corrected_from_test
monitor not detected,No Display / No Signal,auto_corrected_from_test
fix processor too hot,CPU Overheat,auto_corrected_from_test
fix system sluggish,Slow Performance,auto_corrected_from_test
pc processor overheating,CPU Overheat,auto_corrected_from_test
the pc start then off,PSU / Power Issue,auto_corrected_from_test
my pc slow performance,Slow Performance,auto_corrected_from_test
computer internet slow only pc,Wi-Fi Adapter Upgrade,auto_corrected_from_test
No display also GPU bottleneck,No Display / No Signal,auto_corrected_from_test
fix pc beep sound,RAM Upgrade,auto_corrected_from_test
pc wifi not working,Wi-Fi Adapter Upgrade,auto_corrected_from_test
wifi very slow pc issue,Wi-Fi Adapter Upgrade,auto_corrected_from_test
"WiFi connected no internet, USB device not recognized",Wi-Fi Adapter Upgrade,auto_corrected_from_test
fix usb cable issue,USB / Port Issue,auto_corrected_from_test
pc phone not showing,Phone Connection Issue,auto_corrected_from_test
WiFi very slow PC,Wi-Fi Adapter Upgrade,auto_corrected_from_test
wifi disconnect always please,Wi-Fi Adapter Upgrade,auto_corrected_from_test
