user_text,component_label,source
pc not detect wifi please,Wi-Fi Adapter Upgrade,auto_corrected_from_test
my pc dead after power cut,PSU / Power Issue,auto_corrected_from_test
usb port broken,USB / Port Issue,auto_corrected_from_test
pc power button not working,PSU / Power Issue,auto_corrected_from_test
my usb device not recognized,USB / Port Issue,auto_corrected_from_test
help usb port damaged,USB / Port Issue,auto_corrected_from_test
help something wrong pc,General Repair,auto_corrected_from_test
No display plus Game lag graphics,No Display / No Signal,auto_corrected_from_test
PC not detect WiFi USB connection issue,Wi-Fi Adapter Upgrade,auto_corrected_from_test
the system sluggish,Slow Performance,auto_corrected_from_test
processor fan loud please,CPU Overheat,auto_corrected_from_test
usb port broken problem,USB / Port Issue,auto_corrected_from_test
computer pc slow after update,Slow Performance,auto_corrected_from_test
System slow overall,Slow Performance,auto_corrected_from_test
pc on blank screen,No Display / No Signal,auto_corrected_from_test
fix usb cable issue,USB / Port Issue,auto_corrected_from_test
processor overheating issue,CPU Overheat,auto_corrected_from_test
help memory upgrade needed,RAM Upgrade,auto_corrected_from_test
laptop cpu overheating,CPU Overheat,auto_corrected_from_test
phone not connecting problem,Phone Connection Issue,auto_corrected_from_test
computer system sluggish,Slow Performance,auto_corrected_from_test
my laptop charging light blink,PSU / Power Issue,auto_corrected_from_test
laptop graphics card fan loud,GPU Overheat,auto_corrected_from_test
laptop phone not detected,Phone Connection Issue,auto_corrected_from_test
fix usb port broken,USB / Port Issue,auto_corrected_from_test
graphics card overheating issue,GPU Overheat,auto_corrected_from_test
pc not working please,General Repair,auto_corrected_from_test
PC no display VGA,No Display / No Signal,auto_corrected_from_test
laptop pc not boot,Windows Boot Failure,auto_corrected_from_test
port not working please,USB / Port Issue,auto_corrected_from_test
laptop no internet on pc,Wi-Fi Adapter Upgrade,auto_corrected_from_test
Monitor not detected GPU bottleneck,No Display / No Signal,auto_corrected_from_test
PC power flicker plus PC not start after update,PSU / Power Issue,auto_corrected_from_test
fix cpu overheating,CPU Overheat,auto_corrected_from_test
pc not start after update issue,Windows Boot Failure,auto_corrected_from_test
Laptop charging light blink also PC stuck on logo,PSU / Power Issue,auto_corrected_from_test
my monitor no signal,No Display / No Signal,auto_corrected_from_test
usb port damaged please,USB / Port Issue,auto_corrected_from_test
my wifi connected no internet,Wi-Fi Adapter Upgrade,auto_corrected_from_test
pc usb not working,USB / Port Issue,auto_corrected_from_test
phone not recognized please,Phone Connection Issue,auto_corrected_from_test
no internet on pc please,Wi-Fi Adapter Upgrade,auto_corrected_from_test
PC slow boot plus Computer stuck booting,SSD Upgrade,auto_corrected_from_test
pc pc slow loading programs,SSD Upgrade,auto_corrected_from_test
gpu overheat warning problem,GPU Overheat,auto_corrected_from_test
my usb port damaged,USB / Port Issue,auto_corrected_from_test
phone connection problem,Phone Connection Issue,auto_corrected_from_test
laptop phone not recognized,Phone Connection Issue,auto_corrected_from_test
pc no display hdmi problem,No Display / No Signal,auto_corrected_from_test
help pc problem unknown,General Repair,auto_corrected_from_test
USB not working,USB / Port Issue,auto_corrected_from_test
help pc not detect wifi,Wi-Fi Adapter Upgrade,auto_corrected_from_test
pc lag always problem,Slow Performance,auto_corrected_from_test
cpu overheating problem,CPU Overheat,auto_corrected_from_test
laptop usb port not working,USB / Port Issue,auto_corrected_from_test
pc very unresponsive problem,Slow Performance,auto_corrected_from_test
Storage too slow plus PC not start after update,SSD Upgrade,auto_corrected_from_test
pc pc not detect wifi,Wi-Fi Adapter Upgrade,auto_corrected_from_test
the screen black pc on,No Display / No Signal,auto_corrected_from_test
my boot failure,Windows Boot Failure,auto_corrected_from_test
Processor overheating also Computer slow,CPU Overheat,auto_corrected_from_test
help cpu hot always,CPU Overheat,auto_corrected_from_test
no internet on pc,Wi-Fi Adapter Upgrade,auto_corrected_from_test
boot failure please,Windows Boot Failure,auto_corrected_from_test
fix cpu thermal issue,CPU Overheat,auto_corrected_from_test
help pc stuck on logo,Windows Boot Failure,auto_corrected_from_test
laptop pc not start after update,Windows Boot Failure,auto_corrected_from_test
processor too hot,CPU Overheat,auto_corrected_from_test
help phone not detected,Phone Connection Issue,auto_corrected_from_test
phone not connecting,Phone Connection Issue,auto_corrected_from_test
pc issue please,General Repair,auto_corrected_from_test
pc pc slow performance,Slow Performance,auto_corrected_from_test
phone connection problem issue,Phone Connection Issue,auto_corrected_from_test
pc issue issue,General Repair,auto_corrected_from_test
Phone not detected,Phone Connection Issue,auto_corrected_from_test
laptop memory upgrade needed,RAM Upgrade,auto_corrected_from_test
pc not turning on issue,PSU / Power Issue,auto_corrected_from_test
pc no display hdmi please,No Display / No Signal,auto_corrected_from_test
phone connection problem problem,Phone Connection Issue,auto_corrected_from_test
PC no signal display Need better graphics card,No Display / No Signal,auto_corrected_from_test
"PC can't connect WiFi, USB cable issue",Wi-Fi Adapter Upgrade,auto_corrected_from_test
pc pc beep sound,RAM Upgrade,auto_corrected_from_test
pc pc malfunction,General Repair,auto_corrected_from_test
help pc lag always,Slow Performance,auto_corrected_from_test
fix pc not working,General Repair,auto_corrected_from_test
pc can't connect wifi please,Wi-Fi Adapter Upgrade,auto_corrected_from_test
USB cable issue,USB / Port Issue,auto_corrected_from_test
fix monitor not detected,No Display / No Signal,auto_corrected_from_test
fix computer problem,General Repair,auto_corrected_from_test
Internet slow only PC USB connection issue,Wi-Fi Adapter Upgrade,auto_corrected_from_test
laptop cpu overheating,CPU Overheat,auto_corrected_from_test
PC dead after rain plus PC not start after update,PSU / Power Issue,auto_corrected_from_test
help phone connection problem,Phone Connection Issue,auto_corrected_from_test
the pc slow after update,Slow Performance,auto_corrected_from_test
help computer stuck booting,Windows Boot Failure,auto_corrected_from_test
PC no signal display,No Display / No Signal,auto_corrected_from_test
bsod error,Blue Screen (BSOD),auto_corrected_from_test
pc gpu shutdown due to heat,GPU Overheat,auto_corrected_from_test
my graphics card fan loud,GPU Overheat,auto_corrected_from_test
help pc not detect wifi,Wi-Fi Adapter Upgrade,auto_corrected_from_test
gpu overheat warning please,GPU Overheat,auto_corrected_from_test
monitor not detected problem,No Display / No Signal,auto_corrected_from_test
pc no display hdmi problem,No Display / No Signal,auto_corrected_from_test
fix pc slow boot,SSD Upgrade,auto_corrected_from_test
my phone not showing,Phone Connection Issue,auto_corrected_from_test
internet slow only pc please,Wi-Fi Adapter Upgrade,auto_corrected_from_test
my pc issue,General Repair,auto_corrected_from_test
the pc no display hdmi,No Display / No Signal,auto_corrected_from_test
internet slow only pc please,Wi-Fi Adapter Upgrade,auto_corrected_from_test
the phone not showing,Phone Connection Issue,auto_corrected_from_test
computer pc very unresponsive,Slow Performance,auto_corrected_from_test
pc pc no signal display,No Display / No Signal,auto_corrected_from_test
Monitor not detected and GPU performance issue,No Display / No Signal,auto_corrected_from_test
help processor fan loud,CPU Overheat,auto_corrected_from_test
computer usb not working,USB / Port Issue,auto_corrected_from_test
pc not working please,General Repair,auto_corrected_from_test
my pc not working,General Repair,auto_corrected_from_test
wifi not working problem,Wi-Fi Adapter Upgrade,auto_corrected_from_test
my pc shutdown suddenly,PSU / Power Issue,auto_corrected_from_test
processor fan loud please,CPU Overheat,auto_corrected_from_test
pc slow loading programs please,SSD Upgrade,auto_corrected_from_test
"PC can't connect WiFi, USB cable issue",Wi-Fi Adapter Upgrade,auto_corrected_from_test
Computer problem,General Repair,auto_corrected_from_test
pc processor fan loud,CPU Overheat,auto_corrected_from_test
my wifi not working,Wi-Fi Adapter Upgrade,auto_corrected_from_test
gpu thermal issue,GPU Overheat,auto_corrected_from_test
pc not detect wifi,Wi-Fi Adapter Upgrade,auto_corrected_from_test
computer stuck booting issue,Windows Boot Failure,auto_corrected_from_test
computer pc malfunction,General Repair,auto_corrected_from_test
PC no signal display Game lag graphics,No Display / No Signal,auto_corrected_from_test
GPU hot when gaming also System slow overall,GPU Overheat,auto_corrected_from_test
the gpu overheat warning,GPU Overheat,auto_corrected_from_test
the pc slow opening files,SSD Upgrade,auto_corrected_from_test
my pc no display vga,No Display / No Signal,auto_corrected_from_test
pc wifi very slow pc,Wi-Fi Adapter Upgrade,auto_corrected_from_test
pc shutdown suddenly issue,PSU / Power Issue,auto_corrected_from_test
pc slow after update please,Slow Performance,auto_corrected_from_test
"Graphics card overheating, System slow overall",GPU Overheat,auto_corrected_from_test
computer screen black pc on,No Display / No Signal,auto_corrected_from_test
pc slow boot problem,SSD Upgrade,auto_corrected_from_test
PC on blank screen Low FPS problem,No Display / No Signal,auto_corrected_from_test
computer windows not starting,Windows Boot Failure,auto_corrected_from_test
pc not detect wifi please,Wi-Fi Adapter Upgrade,auto_corrected_from_test
pc pc stuck bios,Windows Boot Failure,auto_corrected_from_test
graphics card fan loud problem,GPU Overheat,auto_corrected_from_test
laptop pc not turning on,PSU / Power Issue,auto_corrected_from_test
system slow issue,Slow Performance,auto_corrected_from_test
WiFi very slow PC and USB not detected,Wi-Fi Adapter Upgrade,auto_corrected_from_test
Power button not working,PSU / Power Issue,auto_corrected_from_test
Monitor no signal also GPU performance issue,No Display / No Signal,auto_corrected_from_test
the usb connection issue,USB / Port Issue,auto_corrected_from_test
phone not detected problem,Phone Connection Issue,auto_corrected_from_test
laptop computer stuck booting,Windows Boot Failure,auto_corrected_from_test
pc not working problem,General Repair,auto_corrected_from_test
computer pc issue,General Repair,auto_corrected_from_test
fix phone not showing,Phone Connection Issue,auto_corrected_from_test
pc computer slow,Slow Performance,auto_corrected_from_test
usb not working issue,USB / Port Issue,auto_corrected_from_test
fix pc problem unknown,General Repair,auto_corrected_from_test
pc malfunction problem,General Repair,auto_corrected_from_test
my phone not connecting,Phone Connection Issue,auto_corrected_from_test
PC can't connect WiFi Port not working,Wi-Fi Adapter Upgrade,auto_corrected_from_test
Phone USB issue,Phone Connection Issue,auto_corrected_from_test
no display issue,No Display / No Signal,auto_corrected_from_test
help gpu overheat warning,GPU Overheat,auto_corrected_from_test
fix pc not start after update,Windows Boot Failure,auto_corrected_from_test
PC slow opening files,SSD Upgrade,auto_corrected_from_test
CPU hot always plus PC very slow,CPU Overheat,auto_corrected_from_test
pc slow after update,Slow Performance,auto_corrected_from_test
PC slow opening files plus PC stuck on logo,SSD Upgrade,auto_corrected_from_test
pc malfunction please,General Repair,auto_corrected_from_test
Processor too hot also PC very slow,CPU Overheat,auto_corrected_from_test
pc something wrong pc,General Repair,auto_corrected_from_test
"PC slow opening files, PC stuck startup repair",SSD Upgrade,auto_corrected_from_test
pc no display hdmi,No Display / No Signal,auto_corrected_from_test
pc pc stuck on logo,Windows Boot Failure,auto_corrected_from_test
Processor too hot plus PC very slow,CPU Overheat,auto_corrected_from_test
power button not working problem,PSU / Power Issue,auto_corrected_from_test
pc no display vga please,No Display / No Signal,auto_corrected_from_test
my gpu overheating during games,GPU Overheat,auto_corrected_from_test
help pc very slow,Slow Performance,auto_corrected_from_test
fix phone not connecting,Phone Connection Issue,auto_corrected_from_test
fix gpu overheat warning,GPU Overheat,auto_corrected_from_test
wifi not working issue,Wi-Fi Adapter Upgrade,auto_corrected_from_test
PC can't connect WiFi,Wi-Fi Adapter Upgrade,auto_corrected_from_test
my gpu hot when gaming,GPU Overheat,auto_corrected_from_test
laptop pc can't connect wifi,Wi-Fi Adapter Upgrade,auto_corrected_from_test
computer phone not connecting,Phone Connection Issue,auto_corrected_from_test
laptop usb not detected,USB / Port Issue,auto_corrected_from_test
the cpu overheating,CPU Overheat,auto_corrected_from_test
the monitor not detected,No Display / No Signal,auto_corrected_from_test
laptop windows not starting,Windows Boot Failure,auto_corrected_from_test
laptop pc stuck bios,Windows Boot Failure,auto_corrected_from_test
the laptop charging light blink,PSU / Power Issue,auto_corrected_from_test
computer pc can't connect wifi,Wi-Fi Adapter Upgrade,auto_corrected_from_test
fix screen black pc on,No Display / No Signal,auto_corrected_from_test
laptop usb not detected,USB / Port Issue,auto_corrected_from_test
wifi disconnect always issue,Wi-Fi Adapter Upgrade,auto_corrected_from_test
pc not detect wifi,Wi-Fi Adapter Upgrade,auto_corrected_from_test
the wifi connected no internet,Wi-Fi Adapter Upgrade,auto_corrected_from_test
fix computer stuck booting,Windows Boot Failure,auto_corrected_from_test
CPU overheat warning also PC slow performance,CPU Overheat,auto_corrected_from_test
pc no internet on pc,Wi-Fi Adapter Upgrade,auto_corrected_from_test
screen black pc on problem,No Display / No Signal,auto_corrected_from_test
computer boot failure,Windows Boot Failure,auto_corrected_from_test
the cpu fan not spinning,CPU Overheat,auto_corrected_from_test
"Monitor no signal, Graphics card upgrade needed",No Display / No Signal,auto_corrected_from_test
Phone USB issue,Phone Connection Issue,auto_corrected_from_test
"CPU temperature high, Computer slow",CPU Overheat,auto_corrected_from_test
computer pc problem unknown,General Repair,auto_corrected_from_test
laptop monitor not detected,No Display / No Signal,auto_corrected_from_test
computer internet not working,Wi-Fi Adapter Upgrade,auto_corrected_from_test
fix something wrong pc,General Repair,auto_corrected_from_test
something wrong pc issue,General Repair,auto_corrected_from_test
the wifi disconnect always,Wi-Fi Adapter Upgrade,auto_corrected_from_test
CPU fan not spinning Computer slow RAM not enough,CPU Overheat,auto_corrected_from_test
help pc not boot,Windows Boot Failure,auto_corrected_from_test
phone not detected,Phone Connection Issue,auto_corrected_from_test
CPU overheating,CPU Overheat,auto_corrected_from_test
usb port not working problem,USB / Port Issue,auto_corrected_from_test
pc usb device not recognized,USB / Port Issue,auto_corrected_from_test
power button not working problem,PSU / Power Issue,auto_corrected_from_test
wifi connected no internet,Wi-Fi Adapter Upgrade,auto_corrected_from_test
fix graphics card overheating,GPU Overheat,auto_corrected_from_test
WiFi connected no internet,Wi-Fi Adapter Upgrade,auto_corrected_from_test
usb not working,USB / Port Issue,auto_corrected_from_test
pc pc slow performance,Slow Performance,auto_corrected_from_test
computer memory upgrade needed,RAM Upgrade,auto_corrected_from_test
laptop pc on blank screen,No Display / No Signal,auto_corrected_from_test
the no display,No Display / No Signal,auto_corrected_from_test
phone connection problem please,Phone Connection Issue,auto_corrected_from_test
my gpu hot when gaming,GPU Overheat,auto_corrected_from_test
computer monitor not detected,No Display / No Signal,auto_corrected_from_test
No display,No Display / No Signal,auto_corrected_from_test
fix gpu hot when gaming,GPU Overheat,auto_corrected_from_test
"PC no display HDMI, Graphics card upgrade needed",No Display / No Signal,auto_corrected_from_test
fix graphics card overheating,GPU Overheat,auto_corrected_from_test
wifi very slow pc issue,Wi-Fi Adapter Upgrade,auto_corrected_from_test
pc phone not detected,Phone Connection Issue,auto_corrected_from_test
computer computer slow,Slow Performance,auto_corrected_from_test
computer pc beep sound,RAM Upgrade,auto_corrected_from_test
graphics card overheating please,GPU Overheat,auto_corrected_from_test
laptop pc slow performance,Slow Performance,auto_corrected_from_test
help monitor no signal,No Display / No Signal,auto_corrected_from_test
fix pc no signal display,No Display / No Signal,auto_corrected_from_test
boot failure please,Windows Boot Failure,auto_corrected_from_test
help usb not detected,USB / Port Issue,auto_corrected_from_test
something wrong pc problem,General Repair,auto_corrected_from_test
Processor too hot plus Computer slow,CPU Overheat,auto_corrected_from_test
fix graphics card overheating,GPU Overheat,auto_corrected_from_test
help wifi not working,Wi-Fi Adapter Upgrade,auto_corrected_from_test
screen black pc on issue,No Display / No Signal,auto_corrected_from_test
the phone not showing,Phone Connection Issue,auto_corrected_from_test
help boot failure,Windows Boot Failure,auto_corrected_from_test
computer pc no signal display,No Display / No Signal,auto_corrected_from_test
fix usb not working,USB / Port Issue,auto_corrected_from_test
fix pc very slow,Slow Performance,auto_corrected_from_test
laptop computer problem,General Repair,auto_corrected_from_test
help gpu hot when gaming,GPU Overheat,auto_corrected_from_test
PC very unresponsive,Slow Performance,auto_corrected_from_test
laptop wifi disconnect always,Wi-Fi Adapter Upgrade,auto_corrected_from_test
help something wrong pc,General Repair,auto_corrected_from_test
laptop phone not recognized,Phone Connection Issue,auto_corrected_from_test
pc shutdown suddenly please,PSU / Power Issue,auto_corrected_from_test
computer screen black pc on,No Display / No Signal,auto_corrected_from_test
PC dead after power cut,PSU / Power Issue,auto_corrected_from_test
pc usb device not recognized,USB / Port Issue,auto_corrected_from_test
usb port broken please,USB / Port Issue,auto_corrected_from_test
computer wifi connected no internet,Wi-Fi Adapter Upgrade,auto_corrected_from_test
PC not turning on PC not start after update,PSU / Power Issue,auto_corrected_from_test
the monitor no signal,No Display / No Signal,auto_corrected_from_test
"No power at all, Windows not starting",PSU / Power Issue,auto_corrected_from_test
laptop laptop charging light blink,PSU / Power Issue,auto_corrected_from_test
help pc can't connect wifi,Wi-Fi Adapter Upgrade,auto_corrected_from_test
PC blue screen PC not start after update,Blue Screen (BSOD),auto_corrected_from_test
my pc not working,General Repair,auto_corrected_from_test
the system sluggish,Slow Performance,auto_corrected_from_test
pc malfunction please,General Repair,auto_corrected_from_test
laptop pc no display vga,No Display / No Signal,auto_corrected_from_test
laptop phone not recognized,Phone Connection Issue,auto_corrected_from_test
phone connection problem please,Phone Connection Issue,auto_corrected_from_test
the pc stuck on logo,Windows Boot Failure,auto_corrected_from_test
fix no power at all,PSU / Power Issue,auto_corrected_from_test
PC start then off Boot failure,PSU / Power Issue,auto_corrected_from_test
fix pc slow after update,Slow Performance,auto_corrected_from_test
the phone connection problem,Phone Connection Issue,auto_corrected_from_test
processor too hot,CPU Overheat,auto_corrected_from_test
my something wrong pc,General Repair,auto_corrected_from_test
fix usb device not recognized,USB / Port Issue,auto_corrected_from_test
no power at all problem,PSU / Power Issue,auto_corrected_from_test
USB device not recognized,USB / Port Issue,auto_corrected_from_test
PC dead after power cut plus PC not start after update,PSU / Power Issue,auto_corrected_from_test
pc stuck on logo issue,Windows Boot Failure,auto_corrected_from_test
"CPU overheat warning, PC slow performance, RAM not enough",CPU Overheat,auto_corrected_from_test
computer pc issue,General Repair,auto_corrected_from_test
pc pc problem unknown,General Repair,auto_corrected_from_test
pc usb port broken,USB / Port Issue,auto_corrected_from_test
wifi connected no internet issue,Wi-Fi Adapter Upgrade,auto_corrected_from_test
the gpu overheat warning,GPU Overheat,auto_corrected_from_test
my pc malfunction,General Repair,auto_corrected_from_test
usb device not recognized,USB / Port Issue,auto_corrected_from_test
pc no display vga issue,No Display / No Signal,auto_corrected_from_test
fix pc slow opening files,SSD Upgrade,auto_corrected_from_test
pc lag always please,Slow Performance,auto_corrected_from_test
phone not recognized problem,Phone Connection Issue,auto_corrected_from_test
PC slow opening files plus Windows not starting,SSD Upgrade,auto_corrected_from_test
CPU hot always and PC slow after update,CPU Overheat,auto_corrected_from_test
laptop port not working,USB / Port Issue,auto_corrected_from_test
my no display,No Display / No Signal,auto_corrected_from_test
the pc not boot,Windows Boot Failure,auto_corrected_from_test
help no internet on pc,Wi-Fi Adapter Upgrade,auto_corrected_from_test
pc cpu hot always,CPU Overheat,auto_corrected_from_test
laptop pc problem unknown,General Repair,auto_corrected_from_test
pc pc malfunction,General Repair,auto_corrected_from_test
computer pc problem unknown,General Repair,auto_corrected_from_test
PC not working,General Repair,auto_corrected_from_test
help gpu hot when gaming,GPU Overheat,auto_corrected_from_test
the wifi not working,Wi-Fi Adapter Upgrade,auto_corrected_from_test
Graphics card thermal throttle plus Computer slow,GPU Overheat,auto_corrected_from_test
"No power at all, PC stuck BIOS, Monitor no signal",PSU / Power Issue,auto_corrected_from_test
"No internet on PC, USB port broken",Wi-Fi Adapter Upgrade,auto_corrected_from_test
pc stuck bios issue,Windows Boot Failure,auto_corrected_from_test
fix pc problem unknown,General Repair,auto_corrected_from_test
laptop port not working,USB / Port Issue,auto_corrected_from_test
internet slow only pc,Wi-Fi Adapter Upgrade,auto_corrected_from_test
pc stuck bios issue,Windows Boot Failure,auto_corrected_from_test
pc phone not detected,Phone Connection Issue,auto_corrected_from_test
GPU shutdown due to heat also PC very slow,GPU Overheat,auto_corrected_from_test
"CPU hot always, System sluggish",CPU Overheat,auto_corrected_from_test
fix pc slow after update,Slow Performance,auto_corrected_from_test
fix pc not start after update,Windows Boot Failure,auto_corrected_from_test
pc no display vga,No Display / No Signal,auto_corrected_from_test
bsod error,Blue Screen (BSOD),auto_corrected_from_test
laptop pc no display vga,No Display / No Signal,auto_corrected_from_test
PC slow loading programs,SSD Upgrade,auto_corrected_from_test
bsod error issue,Blue Screen (BSOD),auto_corrected_from_test
fix pc slow loading programs,SSD Upgrade,auto_corrected_from_test
pc issue problem,General Repair,auto_corrected_from_test
computer problem issue,General Repair,auto_corrected_from_test
my system slow overall,Slow Performance,auto_corrected_from_test
help pc start then off,PSU / Power Issue,auto_corrected_from_test
windows not starting,Windows Boot Failure,auto_corrected_from_test
help gpu overheating during games,GPU Overheat,auto_corrected_from_test
USB port not working,USB / Port Issue,auto_corrected_from_test
fix cpu overheating,CPU Overheat,auto_corrected_from_test
Graphics card fan loud plus System slow overall,GPU Overheat,auto_corrected_from_test
fix phone connection problem,Phone Connection Issue,auto_corrected_from_test
pc usb cable issue,USB / Port Issue,auto_corrected_from_test
my phone connection problem,Phone Connection Issue,auto_corrected_from_test
my usb not detected,USB / Port Issue,auto_corrected_from_test
No internet on PC USB cable issue,Wi-Fi Adapter Upgrade,auto_corrected_from_test
pc pc malfunction,General Repair,auto_corrected_from_test
the phone connection problem,Phone Connection Issue,auto_corrected_from_test
help system slow overall,Slow Performance,auto_corrected_from_test
laptop wifi very slow pc,Wi-Fi Adapter Upgrade,auto_corrected_from_test
phone not showing,Phone Connection Issue,auto_corrected_from_test
my phone not detected,Phone Connection Issue,auto_corrected_from_test
help system slow,Slow Performance,auto_corrected_from_test
computer pc stuck loading,Windows Boot Failure,auto_corrected_from_test
No power at all and Boot failure and PC no display HDMI,PSU / Power Issue,auto_corrected_from_test
gpu overheat warning,GPU Overheat,auto_corrected_from_test
PC not detect WiFi USB connection issue,Wi-Fi Adapter Upgrade,auto_corrected_from_test
the usb cable issue,USB / Port Issue,auto_corrected_from_test
pc not detect wifi,Wi-Fi Adapter Upgrade,auto_corrected_from_test
fix laptop error screen,Blue Screen (BSOD),auto_corrected_from_test
the phone connection problem,Phone Connection Issue,auto_corrected_from_test
"PC not turning on, PC not start after update",PSU / Power Issue,auto_corrected_from_test
phone not showing problem,Phone Connection Issue,auto_corrected_from_test
PC can't connect WiFi Port not working,Wi-Fi Adapter Upgrade,auto_corrected_from_test
fix gpu shutdown due to heat,GPU Overheat,auto_corrected_from_test
the windows not starting,Windows Boot Failure,auto_corrected_from_test
