user_text,component_label,source
help pc slow boot,SSD Upgrade,auto_corrected_from_test
fix pc problem unknown,General Repair,auto_corrected_from_test
laptop pc slow loading programs,SSD Upgrade,auto_corrected_from_test
laptop wifi not working,Wi-Fi Adapter Upgrade,auto_corrected_from_test
No display plus GPU performance issue,No Display / No Signal,auto_corrected_from_test
laptop gpu overheat warning,GPU Overheat,auto_corrected_from_test
help pc slow boot,SSD Upgrade,auto_corrected_from_test
help pc slow opening files,SSD Upgrade,auto_corrected_from_test
"Monitor no signal, Graphics not good enough",No Display / No Signal,auto_corrected_from_test
laptop phone connection problem,Phone Connection Issue,auto_corrected_from_test
laptop system slow,Slow Performance,auto_corrected_from_test
monitor not detected problem,No Display / No Signal,auto_corrected_from_test
memory upgrade needed issue,RAM Upgrade,auto_corrected_from_test
phone not recognized issue,Phone Connection Issue,auto_corrected_from_test
"PC not turning on, PC stuck loading",PSU / Power Issue,auto_corrected_from_test
No internet on PC,Wi-Fi Adapter Upgrade,auto_corrected_from_test
no power at all please,PSU / Power Issue,auto_corrected_from_test
pc pc on blank screen,No Display / No Signal,auto_corrected_from_test
no power at all problem,PSU / Power Issue,auto_corrected_from_test
system slow please,Slow Performance,auto_corrected_from_test
my monitor no signal,No Display / No Signal,auto_corrected_from_test
computer usb port not working,USB / Port Issue,auto_corrected_from_test
fix bsod error,Blue Screen (BSOD),auto_corrected_from_test
computer phone connection problem,Phone Connection Issue,auto_corrected_from_test
"PC slow boot, PC stuck loading",SSD Upgrade,auto_corrected_from_test
phone not recognized problem,Phone Connection Issue,auto_corrected_from_test
pc can't connect wifi issue,Wi-Fi Adapter Upgrade,auto_corrected_from_test
pc wifi disconnect always,Wi-Fi Adapter Upgrade,auto_corrected_from_test
CPU overheating,CPU Overheat,auto_corrected_from_test
pc can't connect wifi problem,Wi-Fi Adapter Upgrade,auto_corrected_from_test
computer problem please,General Repair,auto_corrected_from_test
pc usb port damaged,USB / Port Issue,auto_corrected_from_test
computer windows not starting,Windows Boot Failure,auto_corrected_from_test
fix pc issue,General Repair,auto_corrected_from_test
"CPU thermal issue, PC lag always",CPU Overheat,auto_corrected_from_test
my cpu overheating,CPU Overheat,auto_corrected_from_test
Internet slow only PC,Wi-Fi Adapter Upgrade,auto_corrected_from_test
screen black pc on,No Display / No Signal,auto_corrected_from_test
something wrong pc,General Repair,auto_corrected_from_test
pc no power at all,PSU / Power Issue,auto_corrected_from_test
pc phone not showing,Phone Connection Issue,auto_corrected_from_test
Phone not showing,Phone Connection Issue,auto_corrected_from_test
computer computer problem,General Repair,auto_corrected_from_test
Boot failure,Windows Boot Failure,auto_corrected_from_test
my usb port not working,USB / Port Issue,auto_corrected_from_test
something wrong pc,General Repair,auto_corrected_from_test
computer phone not recognized,Phone Connection Issue,auto_corrected_from_test
laptop charging light blink,PSU / Power Issue,auto_corrected_from_test
the phone not showing,Phone Connection Issue,auto_corrected_from_test
pc pc slow boot,SSD Upgrade,auto_corrected_from_test
Something wrong PC,General Repair,auto_corrected_from_test
Memory upgrade needed,RAM Upgrade,auto_corrected_from_test
monitor not detected issue,No Display / No Signal,auto_corrected_from_test
laptop system slow overall,Slow Performance,auto_corrected_from_test
help pc problem unknown,General Repair,auto_corrected_from_test
Processor fan loud and System slow overall,CPU Overheat,auto_corrected_from_test
CPU thermal issue,CPU Overheat,auto_corrected_from_test
wifi not working please,Wi-Fi Adapter Upgrade,auto_corrected_from_test
my power button not working,PSU / Power Issue,auto_corrected_from_test
pc stuck loading please,Windows Boot Failure,auto_corrected_from_test
laptop pc not turning on,PSU / Power Issue,auto_corrected_from_test
computer problem,General Repair,auto_corrected_from_test
No display also Graphics card upgrade needed,No Display / No Signal,auto_corrected_from_test
PC on blank screen also GPU too weak,No Display / No Signal,auto_corrected_from_test
pc internet slow only pc,Wi-Fi Adapter Upgrade,auto_corrected_from_test
help pc no display vga,No Display / No Signal,auto_corrected_from_test
PC slow boot plus PC not start after update,SSD Upgrade,auto_corrected_from_test
the usb port damaged,USB / Port Issue,auto_corrected_from_test
computer no internet on pc,Wi-Fi Adapter Upgrade,auto_corrected_from_test
laptop computer slow,Slow Performance,auto_corrected_from_test
computer pc shutdown suddenly,PSU / Power Issue,auto_corrected_from_test
pc issue please,General Repair,auto_corrected_from_test
no power at all please,PSU / Power Issue,auto_corrected_from_test
pc pc stuck bios,Windows Boot Failure,auto_corrected_from_test
usb cable issue problem,USB / Port Issue,auto_corrected_from_test
Processor fan loud also Computer slow,CPU Overheat,auto_corrected_from_test
laptop usb connection issue,USB / Port Issue,auto_corrected_from_test
pc no display vga issue,No Display / No Signal,auto_corrected_from_test
GPU overheat warning Computer slow,GPU Overheat,auto_corrected_from_test
computer system slow,Slow Performance,auto_corrected_from_test
system sluggish,Slow Performance,auto_corrected_from_test
my power button not working,PSU / Power Issue,auto_corrected_from_test
computer wifi disconnect always,Wi-Fi Adapter Upgrade,auto_corrected_from_test
the pc not boot,Windows Boot Failure,auto_corrected_from_test
laptop port not working,USB / Port Issue,auto_corrected_from_test
usb cable issue please,USB / Port Issue,auto_corrected_from_test
Power button not working PC not boot,PSU / Power Issue,auto_corrected_from_test
computer stuck booting issue,Windows Boot Failure,auto_corrected_from_test
PC on blank screen also GPU performance issue,No Display / No Signal,auto_corrected_from_test
PC issue,General Repair,auto_corrected_from_test
my pc not start after update,Windows Boot Failure,auto_corrected_from_test
my computer problem,General Repair,auto_corrected_from_test
my pc lag always,Slow Performance,auto_corrected_from_test
usb cable issue issue,USB / Port Issue,auto_corrected_from_test
"CPU thermal issue, PC slow performance",CPU Overheat,auto_corrected_from_test
Graphics card thermal throttle PC slow after update,GPU Overheat,auto_corrected_from_test
computer wifi disconnect always,Wi-Fi Adapter Upgrade,auto_corrected_from_test
cpu overheating please,CPU Overheat,auto_corrected_from_test
pc on blank screen please,No Display / No Signal,auto_corrected_from_test
help pc no display vga,No Display / No Signal,auto_corrected_from_test
CPU thermal issue System slow overall,CPU Overheat,auto_corrected_from_test
CPU temperature high plus Computer slow,CPU Overheat,auto_corrected_from_test
No power at all PC stuck BIOS,PSU / Power Issue,auto_corrected_from_test
help pc no signal display,No Display / No Signal,auto_corrected_from_test
no display please,No Display / No Signal,auto_corrected_from_test
"Monitor no signal, GPU performance issue",No Display / No Signal,auto_corrected_from_test
no display,No Display / No Signal,auto_corrected_from_test
my internet slow only pc,Wi-Fi Adapter Upgrade,auto_corrected_from_test
my computer slow,Slow Performance,auto_corrected_from_test
Laptop charging light blink plus Boot failure,PSU / Power Issue,auto_corrected_from_test
phone not connecting please,Phone Connection Issue,auto_corrected_from_test
my processor fan loud,CPU Overheat,auto_corrected_from_test
memory upgrade needed,RAM Upgrade,auto_corrected_from_test
No internet on PC plus USB connection issue,Wi-Fi Adapter Upgrade,auto_corrected_from_test
computer pc start only sometimes,PSU / Power Issue,auto_corrected_from_test
computer phone not showing,Phone Connection Issue,auto_corrected_from_test
phone not connecting,Phone Connection Issue,auto_corrected_from_test
computer gpu shutdown due to heat,GPU Overheat,auto_corrected_from_test
pc not start after update issue,Windows Boot Failure,auto_corrected_from_test
the pc shutdown suddenly,PSU / Power Issue,auto_corrected_from_test
Monitor not detected and Graphics not good enough,No Display / No Signal,auto_corrected_from_test
usb not detected issue,USB / Port Issue,auto_corrected_from_test
Graphics card too hot plus PC slow performance,GPU Overheat,auto_corrected_from_test
my graphics card fan loud,GPU Overheat,auto_corrected_from_test
"PC slow opening files, PC stuck BIOS",SSD Upgrade,auto_corrected_from_test
Processor thermal throttle PC slow performance Memory upgrade required,CPU Overheat,auto_corrected_from_test
WiFi adapter and USB connection problem,Wi-Fi Adapter Upgrade,auto_corrected_from_test
the pc not working,General Repair,auto_corrected_from_test
laptop something wrong pc,General Repair,auto_corrected_from_test
usb device not recognized issue,USB / Port Issue,auto_corrected_from_test
pc start only sometimes problem,PSU / Power Issue,auto_corrected_from_test
Graphics card overheating and System slow overall,GPU Overheat,auto_corrected_from_test
pc cpu fan not spinning,CPU Overheat,auto_corrected_from_test
Laptop error screen PC stuck on logo,Blue Screen (BSOD),auto_corrected_from_test
"CPU shutdown due to heat, System slow overall, RAM not detected",CPU Overheat,auto_corrected_from_test
help processor too hot,CPU Overheat,auto_corrected_from_test
pc usb cable issue,USB / Port Issue,auto_corrected_from_test
pc slow opening files problem,SSD Upgrade,auto_corrected_from_test
PC no display HDMI GPU too weak,No Display / No Signal,auto_corrected_from_test
computer no internet on pc,Wi-Fi Adapter Upgrade,auto_corrected_from_test
pc on blank screen issue,No Display / No Signal,auto_corrected_from_test
usb not detected issue,USB / Port Issue,auto_corrected_from_test
pc usb port not working,USB / Port Issue,auto_corrected_from_test
pc slow performance please,Slow Performance,auto_corrected_from_test
PC start only sometimes also PC not start after update,PSU / Power Issue,auto_corrected_from_test
my gpu shutdown due to heat,GPU Overheat,auto_corrected_from_test
boot failure please,Windows Boot Failure,auto_corrected_from_test
PC dead after power cut PC not boot,PSU / Power Issue,auto_corrected_from_test
fix usb cable issue,USB / Port Issue,auto_corrected_from_test
USB connection issue,USB / Port Issue,auto_corrected_from_test
pc port not working,USB / Port Issue,auto_corrected_from_test
pc stuck bios issue,Windows Boot Failure,auto_corrected_from_test
fix pc start only sometimes,PSU / Power Issue,auto_corrected_from_test
CPU temperature high PC very slow Memory insufficient,CPU Overheat,auto_corrected_from_test
my pc very unresponsive,Slow Performance,auto_corrected_from_test
gpu hot when gaming,GPU Overheat,auto_corrected_from_test
the pc not turning on,PSU / Power Issue,auto_corrected_from_test
fix pc malfunction,General Repair,auto_corrected_from_test
pc problem unknown,General Repair,auto_corrected_from_test
Internet not working plus USB not working,Wi-Fi Adapter Upgrade,auto_corrected_from_test
pc phone connection problem,Phone Connection Issue,auto_corrected_from_test
help phone usb issue,Phone Connection Issue,auto_corrected_from_test
CPU temperature high also Computer slow,CPU Overheat,auto_corrected_from_test
pc pc very unresponsive,Slow Performance,auto_corrected_from_test
help pc very slow,Slow Performance,auto_corrected_from_test
CPU thermal issue also System slow overall,CPU Overheat,auto_corrected_from_test
the phone usb issue,Phone Connection Issue,auto_corrected_from_test
my gpu overheat warning,GPU Overheat,auto_corrected_from_test
my wifi very slow pc,Wi-Fi Adapter Upgrade,auto_corrected_from_test
my bsod error,Blue Screen (BSOD),auto_corrected_from_test
help pc start only sometimes,PSU / Power Issue,auto_corrected_from_test
help phone usb issue,Phone Connection Issue,auto_corrected_from_test
help cpu hot always,CPU Overheat,auto_corrected_from_test
pc lag always problem,Slow Performance,auto_corrected_from_test
fix memory upgrade needed,RAM Upgrade,auto_corrected_from_test
fix pc beep sound,RAM Upgrade,auto_corrected_from_test
"BSOD error, PC not boot",Blue Screen (BSOD),auto_corrected_from_test
no internet on pc issue,Wi-Fi Adapter Upgrade,auto_corrected_from_test
computer monitor no signal,No Display / No Signal,auto_corrected_from_test
help phone not connecting,Phone Connection Issue,auto_corrected_from_test
laptop gpu thermal issue,GPU Overheat,auto_corrected_from_test
Phone connection problem,Phone Connection Issue,auto_corrected_from_test
my laptop error screen,Blue Screen (BSOD),auto_corrected_from_test
help gpu shutdown due to heat,GPU Overheat,auto_corrected_from_test
GPU overheat warning and PC very unresponsive,GPU Overheat,auto_corrected_from_test
my gpu overheat warning,GPU Overheat,auto_corrected_from_test
my usb device not recognized,USB / Port Issue,auto_corrected_from_test
Monitor not detected plus Graphics card not detect,No Display / No Signal,auto_corrected_from_test
cpu thermal issue issue,CPU Overheat,auto_corrected_from_test
CPU fan not spinning plus System slow overall,CPU Overheat,auto_corrected_from_test
gpu hot when gaming,GPU Overheat,auto_corrected_from_test
fix pc start only sometimes,PSU / Power Issue,auto_corrected_from_test
the pc not working,General Repair,auto_corrected_from_test
phone not detected problem,Phone Connection Issue,auto_corrected_from_test
pc on blank screen please,No Display / No Signal,auto_corrected_from_test
Blue screen crash also PC not start after update,Blue Screen (BSOD),auto_corrected_from_test
pc pc not boot,Windows Boot Failure,auto_corrected_from_test
pc stuck startup repair please,Windows Boot Failure,auto_corrected_from_test
my laptop error screen,Blue Screen (BSOD),auto_corrected_from_test
fix windows not starting,Windows Boot Failure,auto_corrected_from_test
my phone not connecting,Phone Connection Issue,auto_corrected_from_test
fix processor fan loud,CPU Overheat,auto_corrected_from_test
my wifi very slow pc,Wi-Fi Adapter Upgrade,auto_corrected_from_test
Processor too hot and System slow,CPU Overheat,auto_corrected_from_test
No display,No Display / No Signal,auto_corrected_from_test
SSD performance and PC not start after update,SSD Upgrade,auto_corrected_from_test
USB device not recognized,USB / Port Issue,auto_corrected_from_test
laptop boot failure,Windows Boot Failure,auto_corrected_from_test
Monitor not detected,No Display / No Signal,auto_corrected_from_test
pc pc no signal display,No Display / No Signal,auto_corrected_from_test
wifi connected no internet please,Wi-Fi Adapter Upgrade,auto_corrected_from_test
pc slow opening files,SSD Upgrade,auto_corrected_from_test
fix pc very slow,Slow Performance,auto_corrected_from_test
Computer problem,General Repair,auto_corrected_from_test
gpu shutdown due to heat please,GPU Overheat,auto_corrected_from_test
my computer slow,Slow Performance,auto_corrected_from_test
laptop pc malfunction,General Repair,auto_corrected_from_test
phone not recognized please,Phone Connection Issue,auto_corrected_from_test
phone usb issue,Phone Connection Issue,auto_corrected_from_test
processor too hot please,CPU Overheat,auto_corrected_from_test
laptop no power at all,PSU / Power Issue,auto_corrected_from_test
the pc beep sound,RAM Upgrade,auto_corrected_from_test
wifi very slow pc problem,Wi-Fi Adapter Upgrade,auto_corrected_from_test
fix internet slow only pc,Wi-Fi Adapter Upgrade,auto_corrected_from_test
computer pc stuck startup repair,Windows Boot Failure,auto_corrected_from_test
GPU overheating during games and PC slow performance,GPU Overheat,auto_corrected_from_test
my system sluggish,Slow Performance,auto_corrected_from_test
Power button not working,PSU / Power Issue,auto_corrected_from_test
phone usb issue,Phone Connection Issue,auto_corrected_from_test
help processor fan loud,CPU Overheat,auto_corrected_from_test
gpu shutdown due to heat,GPU Overheat,auto_corrected_from_test
pc stuck startup repair please,Windows Boot Failure,auto_corrected_from_test
PC not turning on also Computer stuck booting,PSU / Power Issue,auto_corrected_from_test
SSD not fast enough plus PC not start after update,SSD Upgrade,auto_corrected_from_test
internet not working,Wi-Fi Adapter Upgrade,auto_corrected_from_test
pc pc slow opening files,SSD Upgrade,auto_corrected_from_test
my pc lag always,Slow Performance,auto_corrected_from_test
help internet not working,Wi-Fi Adapter Upgrade,auto_corrected_from_test
computer phone connection problem,Phone Connection Issue,auto_corrected_from_test
the gpu hot when gaming,GPU Overheat,auto_corrected_from_test
CPU thermal issue PC lag always Memory insufficient,CPU Overheat,auto_corrected_from_test
my computer problem,General Repair,auto_corrected_from_test
fix pc problem unknown,General Repair,auto_corrected_from_test
fix pc problem unknown,General Repair,auto_corrected_from_test
pc laptop error screen,Blue Screen (BSOD),auto_corrected_from_test
laptop charging light blink,PSU / Power Issue,auto_corrected_from_test
computer computer slow,Slow Performance,auto_corrected_from_test
no display issue,No Display / No Signal,auto_corrected_from_test
USB device not recognized,USB / Port Issue,auto_corrected_from_test
CPU temperature high plus System slow overall,CPU Overheat,auto_corrected_from_test
no display issue,No Display / No Signal,auto_corrected_from_test
computer phone not detected,Phone Connection Issue,auto_corrected_from_test
pc stuck startup repair issue,Windows Boot Failure,auto_corrected_from_test
help pc on blank screen,No Display / No Signal,auto_corrected_from_test
laptop no internet on pc,Wi-Fi Adapter Upgrade,auto_corrected_from_test
GPU thermal issue also PC slow after update,GPU Overheat,auto_corrected_from_test
pc slow opening files,SSD Upgrade,auto_corrected_from_test
Windows crash suddenly also PC stuck on logo,Blue Screen (BSOD),auto_corrected_from_test
graphics card fan loud please,GPU Overheat,auto_corrected_from_test
fix wifi very slow pc,Wi-Fi Adapter Upgrade,auto_corrected_from_test
my pc problem unknown,General Repair,auto_corrected_from_test
my boot failure,Windows Boot Failure,auto_corrected_from_test
pc phone not detected,Phone Connection Issue,auto_corrected_from_test
laptop phone not connecting,Phone Connection Issue,auto_corrected_from_test
WiFi connected no internet,Wi-Fi Adapter Upgrade,auto_corrected_from_test
laptop graphics card overheating,GPU Overheat,auto_corrected_from_test
computer pc slow boot,SSD Upgrade,auto_corrected_from_test
my pc malfunction,General Repair,auto_corrected_from_test
computer stuck booting please,Windows Boot Failure,auto_corrected_from_test
CPU temperature high System slow overall RAM not detected,CPU Overheat,auto_corrected_from_test
the pc beep sound,RAM Upgrade,auto_corrected_from_test
no power at all please,PSU / Power Issue,auto_corrected_from_test
pc malfunction please,General Repair,auto_corrected_from_test
pc start only sometimes issue,PSU / Power Issue,auto_corrected_from_test
pc not working please,General Repair,auto_corrected_from_test
phone connection problem problem,Phone Connection Issue,auto_corrected_from_test
WiFi disconnect always and Port not working,Wi-Fi Adapter Upgrade,auto_corrected_from_test
usb connection issue,USB / Port Issue,auto_corrected_from_test
PC not working,General Repair,auto_corrected_from_test
pc pc beep sound,RAM Upgrade,auto_corrected_from_test
my system slow overall,Slow Performance,auto_corrected_from_test
pc not start after update problem,Windows Boot Failure,auto_corrected_from_test
wifi very slow pc please,Wi-Fi Adapter Upgrade,auto_corrected_from_test
PC start then off,PSU / Power Issue,auto_corrected_from_test
fix pc on blank screen,No Display / No Signal,auto_corrected_from_test
the usb cable issue,USB / Port Issue,auto_corrected_from_test
fix phone not showing,Phone Connection Issue,auto_corrected_from_test
fix pc stuck on logo,Windows Boot Failure,auto_corrected_from_test
the cpu overheating,CPU Overheat,auto_corrected_from_test
wifi connected no internet,Wi-Fi Adapter Upgrade,auto_corrected_from_test
pc slow loading programs please,SSD Upgrade,auto_corrected_from_test
wifi very slow pc problem,Wi-Fi Adapter Upgrade,auto_corrected_from_test
wifi connected no internet please,Wi-Fi Adapter Upgrade,auto_corrected_from_test
Something wrong PC,General Repair,auto_corrected_from_test
laptop something wrong pc,General Repair,auto_corrected_from_test
fix processor fan loud,CPU Overheat,auto_corrected_from_test
fix pc problem unknown,General Repair,auto_corrected_from_test
No display also GPU too weak,No Display / No Signal,auto_corrected_from_test
laptop pc stuck on logo,Windows Boot Failure,auto_corrected_from_test
pc pc slow loading programs,SSD Upgrade,auto_corrected_from_test
PC slow loading programs PC stuck startup repair,SSD Upgrade,auto_corrected_from_test
my pc stuck bios,Windows Boot Failure,auto_corrected_from_test
laptop pc no signal display,No Display / No Signal,auto_corrected_from_test
pc slow loading programs problem,SSD Upgrade,auto_corrected_from_test
pc pc problem unknown,General Repair,auto_corrected_from_test
pc usb cable issue,USB / Port Issue,auto_corrected_from_test
phone not recognized please,Phone Connection Issue,auto_corrected_from_test
pc windows not starting,Windows Boot Failure,auto_corrected_from_test
system slow problem,Slow Performance,auto_corrected_from_test
pc usb port not working,USB / Port Issue,auto_corrected_from_test
"CPU temperature high, System slow overall",CPU Overheat,auto_corrected_from_test
PC slow loading programs,SSD Upgrade,auto_corrected_from_test
laptop error screen,Blue Screen (BSOD),auto_corrected_from_test
No power at all Boot failure,PSU / Power Issue,auto_corrected_from_test
computer pc issue,General Repair,auto_corrected_from_test
fix phone not showing,Phone Connection Issue,auto_corrected_from_test
Screen black PC on plus GPU too weak,No Display / No Signal,auto_corrected_from_test
Computer problem,General Repair,auto_corrected_from_test
wifi disconnect always problem,Wi-Fi Adapter Upgrade,auto_corrected_from_test
the pc shutdown suddenly,PSU / Power Issue,auto_corrected_from_test
cpu thermal issue problem,CPU Overheat,auto_corrected_from_test
the wifi disconnect always,Wi-Fi Adapter Upgrade,auto_corrected_from_test
pc not working,General Repair,auto_corrected_from_test
computer pc no display hdmi,No Display / No Signal,auto_corrected_from_test
pc pc stuck bios,Windows Boot Failure,auto_corrected_from_test
computer usb device not recognized,USB / Port Issue,auto_corrected_from_test
CPU cooling problem Computer slow Need more RAM,CPU Overheat,auto_corrected_from_test
laptop wifi very slow pc,Wi-Fi Adapter Upgrade,auto_corrected_from_test
my phone not showing,Phone Connection Issue,auto_corrected_from_test
phone not connecting,Phone Connection Issue,auto_corrected_from_test
"Processor too hot, PC slow performance",CPU Overheat,auto_corrected_from_test
Computer slow,Slow Performance,auto_corrected_from_test
PC not turning on,PSU / Power Issue,auto_corrected_from_test
pc pc malfunction,General Repair,auto_corrected_from_test
something wrong pc problem,General Repair,auto_corrected_from_test
USB cable issue,USB / Port Issue,auto_corrected_from_test
computer pc not detect wifi,Wi-Fi Adapter Upgrade,auto_corrected_from_test
wifi not working problem,Wi-Fi Adapter Upgrade,auto_corrected_from_test
boot failure please,Windows Boot Failure,auto_corrected_from_test
Monitor no signal and Need better graphics card,No Display / No Signal,auto_corrected_from_test
PC malfunction,General Repair,auto_corrected_from_test
pc issue problem,General Repair,auto_corrected_from_test
help computer stuck booting,Windows Boot Failure,auto_corrected_from_test
pc very slow please,Slow Performance,auto_corrected_from_test
usb cable issue problem,USB / Port Issue,auto_corrected_from_test
"Internet not working, USB not working",Wi-Fi Adapter Upgrade,auto_corrected_from_test
pc not boot problem,Windows Boot Failure,auto_corrected_from_test
my pc issue,General Repair,auto_corrected_from_test
laptop pc very unresponsive,Slow Performance,auto_corrected_from_test
CPU fan not spinning Computer slow Need more RAM,CPU Overheat,auto_corrected_from_test
processor too hot,CPU Overheat,auto_corrected_from_test
computer pc slow opening files,SSD Upgrade,auto_corrected_from_test
Processor thermal throttle also Computer slow,CPU Overheat,auto_corrected_from_test
system sluggish issue,Slow Performance,auto_corrected_from_test
help windows not starting,Windows Boot Failure,auto_corrected_from_test
WiFi connected no internet,Wi-Fi Adapter Upgrade,auto_corrected_from_test
fix pc not boot,Windows Boot Failure,auto_corrected_from_test
my pc not working,General Repair,auto_corrected_from_test
pc not start after update issue,Windows Boot Failure,auto_corrected_from_test
pc malfunction issue,General Repair,auto_corrected_from_test
memory upgrade needed issue,RAM Upgrade,auto_corrected_from_test
pc dead after power cut issue,PSU / Power Issue,auto_corrected_from_test
laptop pc not turning on,PSU / Power Issue,auto_corrected_from_test
pc lag always please,Slow Performance,auto_corrected_from_test
USB port damaged,USB / Port Issue,auto_corrected_from_test
laptop wifi very slow pc,Wi-Fi Adapter Upgrade,auto_corrected_from_test
PC slow opening files also Computer stuck booting,SSD Upgrade,auto_corrected_from_test
the phone not recognized,Phone Connection Issue,auto_corrected_from_test
Processor overheating,CPU Overheat,auto_corrected_from_test
PC not working,General Repair,auto_corrected_from_test
the usb device not recognized,USB / Port Issue,auto_corrected_from_test
pc slow opening files please,SSD Upgrade,auto_corrected_from_test
