user_text,component_label,source
GPU hot when gaming Computer slow,GPU Overheat,auto_corrected_from_test
CPU overheating Computer slow,CPU Overheat,auto_corrected_from_test
SSD performance also PC not start after update,SSD Upgrade,auto_corrected_from_test
No power at all and PC stuck loading and PC no display HDMI,PSU / Power Issue,auto_corrected_from_test
pc slow loading programs issue,SSD Upgrade,auto_corrected_from_test
my bsod error,Blue Screen (BSOD),auto_corrected_from_test
pc very unresponsive issue,Slow Performance,auto_corrected_from_test
pc gpu overheat warning,GPU Overheat,auto_corrected_from_test
PC can't connect WiFi USB connection issue,Wi-Fi Adapter Upgrade,auto_corrected_from_test
pc usb port not working,USB / Port Issue,auto_corrected_from_test
pc system sluggish,Slow Performance,auto_corrected_from_test
pc pc stuck on logo,Windows Boot Failure,auto_corrected_from_test
laptop monitor not detected,No Display / No Signal,auto_corrected_from_test
my something wrong pc,General Repair,auto_corrected_from_test
laptop pc very unresponsive,Slow Performance,auto_corrected_from_test
PC on blank screen plus Need better graphics card,No Display / No Signal,auto_corrected_from_test
fix pc no signal display,No Display / No Signal,auto_corrected_from_test
computer usb not working,USB / Port Issue,auto_corrected_from_test
Screen black PC on and Graphics not good enough,No Display / No Signal,auto_corrected_from_test
"CPU shutdown due to heat, Computer slow, Memory insufficient",CPU Overheat,auto_corrected_from_test
pc usb connection issue,USB / Port Issue,auto_corrected_from_test
phone not connecting issue,Phone Connection Issue,auto_corrected_from_test
PC not start after update,Windows Boot Failure,auto_corrected_from_test
pc internet not working,Wi-Fi Adapter Upgrade,auto_corrected_from_test
phone not detected problem,Phone Connection Issue,auto_corrected_from_test
Phone USB issue,Phone Connection Issue,auto_corrected_from_test
pc port not working,USB / Port Issue,auto_corrected_from_test
fix power button not working,PSU / Power Issue,auto_corrected_from_test
pc stuck bios please,Windows Boot Failure,auto_corrected_from_test
internet slow only pc,Wi-Fi Adapter Upgrade,auto_corrected_from_test
my system slow,Slow Performance,auto_corrected_from_test
fix phone not recognized,Phone Connection Issue,auto_corrected_from_test
my pc beep sound,RAM Upgrade,auto_corrected_from_test
pc wifi very slow pc,Wi-Fi Adapter Upgrade,auto_corrected_from_test
CPU fan not spinning plus PC slow after update,CPU Overheat,auto_corrected_from_test
fix usb device not recognized,USB / Port Issue,auto_corrected_from_test
Storage upgrade required also PC not start after update,SSD Upgrade,auto_corrected_from_test
pc not detect wifi problem,Wi-Fi Adapter Upgrade,auto_corrected_from_test
memory upgrade needed,RAM Upgrade,auto_corrected_from_test
phone connection problem,Phone Connection Issue,auto_corrected_from_test
PC no display VGA,No Display / No Signal,auto_corrected_from_test
Power button not working PC not boot,PSU / Power Issue,auto_corrected_from_test
computer pc not working,General Repair,auto_corrected_from_test
PC no display VGA also Low FPS problem,No Display / No Signal,auto_corrected_from_test
pc shutdown suddenly,PSU / Power Issue,auto_corrected_from_test
memory upgrade needed issue,RAM Upgrade,auto_corrected_from_test
pc not boot issue,Windows Boot Failure,auto_corrected_from_test
fix gpu overheat warning,GPU Overheat,auto_corrected_from_test
pc pc no display hdmi,No Display / No Signal,auto_corrected_from_test
processor too hot,CPU Overheat,auto_corrected_from_test
Phone USB issue,Phone Connection Issue,auto_corrected_from_test
the port not working,USB / Port Issue,auto_corrected_from_test
laptop pc very slow,Slow Performance,auto_corrected_from_test
my pc not detect wifi,Wi-Fi Adapter Upgrade,auto_corrected_from_test
usb not detected problem,USB / Port Issue,auto_corrected_from_test
No internet on PC plus USB connection issue,Wi-Fi Adapter Upgrade,auto_corrected_from_test
the cpu overheating,CPU Overheat,auto_corrected_from_test
internet slow only pc issue,Wi-Fi Adapter Upgrade,auto_corrected_from_test
USB connection issue,USB / Port Issue,auto_corrected_from_test
laptop screen black pc on,No Display / No Signal,auto_corrected_from_test
help pc slow after update,Slow Performance,auto_corrected_from_test
my usb connection issue,USB / Port Issue,auto_corrected_from_test
the usb port damaged,USB / Port Issue,auto_corrected_from_test
pc no power at all,PSU / Power Issue,auto_corrected_from_test
"Graphics card too hot, Computer slow",GPU Overheat,auto_corrected_from_test
monitor no signal,No Display / No Signal,auto_corrected_from_test
Monitor no signal Graphics not good enough,No Display / No Signal,auto_corrected_from_test
CPU fan not spinning also PC very unresponsive,CPU Overheat,auto_corrected_from_test
pc shutdown suddenly problem,PSU / Power Issue,auto_corrected_from_test
my gpu overheat warning,GPU Overheat,auto_corrected_from_test
computer problem problem,General Repair,auto_corrected_from_test
computer phone connection problem,Phone Connection Issue,auto_corrected_from_test
Screen black PC on also Low FPS problem,No Display / No Signal,auto_corrected_from_test
pc phone not showing,Phone Connection Issue,auto_corrected_from_test
system slow overall problem,Slow Performance,auto_corrected_from_test
the phone not detected,Phone Connection Issue,auto_corrected_from_test
boot failure please,Windows Boot Failure,auto_corrected_from_test
Power button not working and PC stuck on logo and Screen black PC on,PSU / Power Issue,auto_corrected_from_test
the usb cable issue,USB / Port Issue,auto_corrected_from_test
pc gpu thermal issue,GPU Overheat,auto_corrected_from_test
Monitor not detected,No Display / No Signal,auto_corrected_from_test
help phone usb issue,Phone Connection Issue,auto_corrected_from_test
usb device not recognized please,USB / Port Issue,auto_corrected_from_test
pc malfunction issue,General Repair,auto_corrected_from_test
system slow please,Slow Performance,auto_corrected_from_test
system slow overall please,Slow Performance,auto_corrected_from_test
PC not working,General Repair,auto_corrected_from_test
computer gpu thermal issue,GPU Overheat,auto_corrected_from_test
monitor not detected please,No Display / No Signal,auto_corrected_from_test
pc computer slow,Slow Performance,auto_corrected_from_test
fix pc start only sometimes,PSU / Power Issue,auto_corrected_from_test
no internet on pc issue,Wi-Fi Adapter Upgrade,auto_corrected_from_test
pc pc stuck loading,Windows Boot Failure,auto_corrected_from_test
laptop usb connection issue,USB / Port Issue,auto_corrected_from_test
pc pc no signal display,No Display / No Signal,auto_corrected_from_test
pc no display hdmi please,No Display / No Signal,auto_corrected_from_test
cpu thermal issue please,CPU Overheat,auto_corrected_from_test
no power at all,PSU / Power Issue,auto_corrected_from_test
BSOD error PC not boot,Blue Screen (BSOD),auto_corrected_from_test
pc not detect wifi issue,Wi-Fi Adapter Upgrade,auto_corrected_from_test
my usb device not recognized,USB / Port Issue,auto_corrected_from_test
PC shutdown suddenly and PC not start after update and Monitor no signal,PSU / Power Issue,auto_corrected_from_test
pc pc not boot,Windows Boot Failure,auto_corrected_from_test
laptop pc malfunction,General Repair,auto_corrected_from_test
help windows not starting,Windows Boot Failure,auto_corrected_from_test
computer bsod error,Blue Screen (BSOD),auto_corrected_from_test
my pc stuck on logo,Windows Boot Failure,auto_corrected_from_test
pc malfunction please,General Repair,auto_corrected_from_test
fix bsod error,Blue Screen (BSOD),auto_corrected_from_test
fix phone not connecting,Phone Connection Issue,auto_corrected_from_test
PC slow after update,Slow Performance,auto_corrected_from_test
computer laptop error screen,Blue Screen (BSOD),auto_corrected_from_test
pc shutdown suddenly please,PSU / Power Issue,auto_corrected_from_test
Windows crash suddenly PC stuck on logo,Blue Screen (BSOD),auto_corrected_from_test
help pc stuck bios,Windows Boot Failure,auto_corrected_from_test
computer phone not detected,Phone Connection Issue,auto_corrected_from_test
Laptop charging light blink,PSU / Power Issue,auto_corrected_from_test
pc not boot issue,Windows Boot Failure,auto_corrected_from_test
fix port not working,USB / Port Issue,auto_corrected_from_test
"Monitor no signal, GPU bottleneck",No Display / No Signal,auto_corrected_from_test
my processor too hot,CPU Overheat,auto_corrected_from_test
fix computer slow,Slow Performance,auto_corrected_from_test
PC stuck on logo,Windows Boot Failure,auto_corrected_from_test
PC shutdown suddenly PC stuck BIOS,PSU / Power Issue,auto_corrected_from_test
fix cpu overheating,CPU Overheat,auto_corrected_from_test
port not working problem,USB / Port Issue,auto_corrected_from_test
the processor fan loud,CPU Overheat,auto_corrected_from_test
usb port not working,USB / Port Issue,auto_corrected_from_test
pc can't connect wifi issue,Wi-Fi Adapter Upgrade,auto_corrected_from_test
laptop pc not start after update,Windows Boot Failure,auto_corrected_from_test
help power button not working,PSU / Power Issue,auto_corrected_from_test
fix windows not starting,Windows Boot Failure,auto_corrected_from_test
PC slow boot PC stuck on logo,SSD Upgrade,auto_corrected_from_test
the pc slow opening files,SSD Upgrade,auto_corrected_from_test
gpu hot when gaming please,GPU Overheat,auto_corrected_from_test
help pc on blank screen,No Display / No Signal,auto_corrected_from_test
fix gpu hot when gaming,GPU Overheat,auto_corrected_from_test
PC slow boot PC stuck startup repair,SSD Upgrade,auto_corrected_from_test
pc not boot please,Windows Boot Failure,auto_corrected_from_test
phone not showing issue,Phone Connection Issue,auto_corrected_from_test
pc computer problem,General Repair,auto_corrected_from_test
help phone not detected,Phone Connection Issue,auto_corrected_from_test
pc not working please,General Repair,auto_corrected_from_test
pc pc not turning on,PSU / Power Issue,auto_corrected_from_test
laptop no internet on pc,Wi-Fi Adapter Upgrade,auto_corrected_from_test
laptop pc dead after power cut,PSU / Power Issue,auto_corrected_from_test
pc bsod error,Blue Screen (BSOD),auto_corrected_from_test
the processor too hot,CPU Overheat,auto_corrected_from_test
laptop cpu hot always,CPU Overheat,auto_corrected_from_test
help internet slow only pc,Wi-Fi Adapter Upgrade,auto_corrected_from_test
pc no internet on pc,Wi-Fi Adapter Upgrade,auto_corrected_from_test
fix pc on blank screen,No Display / No Signal,auto_corrected_from_test
PC no signal and Graphics not good enough,No Display / No Signal,auto_corrected_from_test
fix usb cable issue,USB / Port Issue,auto_corrected_from_test
pc something wrong pc,General Repair,auto_corrected_from_test
the pc no signal display,No Display / No Signal,auto_corrected_from_test
pc slow performance issue,Slow Performance,auto_corrected_from_test
help pc stuck on logo,Windows Boot Failure,auto_corrected_from_test
laptop error screen please,Blue Screen (BSOD),auto_corrected_from_test
my computer problem,General Repair,auto_corrected_from_test
the pc no display hdmi,No Display / No Signal,auto_corrected_from_test
pc malfunction problem,General Repair,auto_corrected_from_test
fix pc shutdown suddenly,PSU / Power Issue,auto_corrected_from_test
fix computer slow,Slow Performance,auto_corrected_from_test
pc no signal display issue,No Display / No Signal,auto_corrected_from_test
Monitor no signal GPU too weak,No Display / No Signal,auto_corrected_from_test
No power at all,PSU / Power Issue,auto_corrected_from_test
my wifi connected no internet,Wi-Fi Adapter Upgrade,auto_corrected_from_test
screen black pc on,No Display / No Signal,auto_corrected_from_test
help phone connection problem,Phone Connection Issue,auto_corrected_from_test
Graphics card thermal throttle plus PC slow performance,GPU Overheat,auto_corrected_from_test
my boot failure,Windows Boot Failure,auto_corrected_from_test
GPU overheat warning System slow overall,GPU Overheat,auto_corrected_from_test
computer usb cable issue,USB / Port Issue,auto_corrected_from_test
"PC no signal, Graphics card upgrade needed",No Display / No Signal,auto_corrected_from_test
computer problem problem,General Repair,auto_corrected_from_test
Processor too hot,CPU Overheat,auto_corrected_from_test
phone not showing please,Phone Connection Issue,auto_corrected_from_test
PC start only sometimes,PSU / Power Issue,auto_corrected_from_test
the screen black pc on,No Display / No Signal,auto_corrected_from_test
computer gpu hot when gaming,GPU Overheat,auto_corrected_from_test
help system slow,Slow Performance,auto_corrected_from_test
"PC not turning on, PC stuck startup repair",PSU / Power Issue,auto_corrected_from_test
usb not detected,USB / Port Issue,auto_corrected_from_test
wifi disconnect always issue,Wi-Fi Adapter Upgrade,auto_corrected_from_test
fix phone not detected,Phone Connection Issue,auto_corrected_from_test
wifi disconnect always issue,Wi-Fi Adapter Upgrade,auto_corrected_from_test
computer pc not detect wifi,Wi-Fi Adapter Upgrade,auto_corrected_from_test
CPU thermal issue plus System sluggish,CPU Overheat,auto_corrected_from_test
pc beep sound please,RAM Upgrade,auto_corrected_from_test
pc pc no display vga,No Display / No Signal,auto_corrected_from_test
PC not working,General Repair,auto_corrected_from_test
phone usb issue please,Phone Connection Issue,auto_corrected_from_test
help graphics card overheating,GPU Overheat,auto_corrected_from_test
No display and Low FPS problem,No Display / No Signal,auto_corrected_from_test
pc not detect wifi problem,Wi-Fi Adapter Upgrade,auto_corrected_from_test
the cpu fan not spinning,CPU Overheat,auto_corrected_from_test
PC can't connect WiFi,Wi-Fi Adapter Upgrade,auto_corrected_from_test
the no display,No Display / No Signal,auto_corrected_from_test
bsod error issue,Blue Screen (BSOD),auto_corrected_from_test
pc very unresponsive,Slow Performance,auto_corrected_from_test
Phone connection problem,Phone Connection Issue,auto_corrected_from_test
internet slow only pc problem,Wi-Fi Adapter Upgrade,auto_corrected_from_test
pc no signal display issue,No Display / No Signal,auto_corrected_from_test
laptop computer problem,General Repair,auto_corrected_from_test
system slow,Slow Performance,auto_corrected_from_test
Phone not detected,Phone Connection Issue,auto_corrected_from_test
PC stuck startup repair,Windows Boot Failure,auto_corrected_from_test
pc shutdown suddenly,PSU / Power Issue,auto_corrected_from_test
GPU temperature high plus PC slow after update,GPU Overheat,auto_corrected_from_test
the pc slow loading programs,SSD Upgrade,auto_corrected_from_test
laptop usb cable issue,USB / Port Issue,auto_corrected_from_test
"Processor thermal throttle, PC lag always, Memory insufficient",CPU Overheat,auto_corrected_from_test
Screen black PC on also GPU too weak,No Display / No Signal,auto_corrected_from_test
the no display,No Display / No Signal,auto_corrected_from_test
PC slow opening files also PC stuck on logo,SSD Upgrade,auto_corrected_from_test
computer phone connection problem,Phone Connection Issue,auto_corrected_from_test
pc phone connection problem,Phone Connection Issue,auto_corrected_from_test
Processor too hot also PC slow performance,CPU Overheat,auto_corrected_from_test
"PC slow boot, PC stuck BIOS",SSD Upgrade,auto_corrected_from_test
pc slow boot problem,SSD Upgrade,auto_corrected_from_test
fix usb cable issue,USB / Port Issue,auto_corrected_from_test
power button not working,PSU / Power Issue,auto_corrected_from_test
usb device not recognized please,USB / Port Issue,auto_corrected_from_test
GPU cooling problem Computer slow,GPU Overheat,auto_corrected_from_test
my boot failure,Windows Boot Failure,auto_corrected_from_test
help system slow,Slow Performance,auto_corrected_from_test
pc monitor no signal,No Display / No Signal,auto_corrected_from_test
Monitor not detected also Graphics card not detect,No Display / No Signal,auto_corrected_from_test
computer pc not working,General Repair,auto_corrected_from_test
Windows not starting,Windows Boot Failure,auto_corrected_from_test
the pc can't connect wifi,Wi-Fi Adapter Upgrade,auto_corrected_from_test
phone not showing problem,Phone Connection Issue,auto_corrected_from_test
my phone not showing,Phone Connection Issue,auto_corrected_from_test
computer phone usb issue,Phone Connection Issue,auto_corrected_from_test
cpu fan not spinning issue,CPU Overheat,auto_corrected_from_test
laptop pc malfunction,General Repair,auto_corrected_from_test
pc not detect wifi issue,Wi-Fi Adapter Upgrade,auto_corrected_from_test
gpu thermal issue please,GPU Overheat,auto_corrected_from_test
computer slow please,Slow Performance,auto_corrected_from_test
fix pc slow boot,SSD Upgrade,auto_corrected_from_test
help gpu hot when gaming,GPU Overheat,auto_corrected_from_test
"GPU hot when gaming, System slow overall",GPU Overheat,auto_corrected_from_test
help gpu overheating during games,GPU Overheat,auto_corrected_from_test
PC dead after rain PC not start after update,PSU / Power Issue,auto_corrected_from_test
the pc not working,General Repair,auto_corrected_from_test
fix pc not detect wifi,Wi-Fi Adapter Upgrade,auto_corrected_from_test
system sluggish,Slow Performance,auto_corrected_from_test
the screen black pc on,No Display / No Signal,auto_corrected_from_test
windows not starting problem,Windows Boot Failure,auto_corrected_from_test
"CPU hot always, System slow overall",CPU Overheat,auto_corrected_from_test
laptop pc problem unknown,General Repair,auto_corrected_from_test
no power at all please,PSU / Power Issue,auto_corrected_from_test
PC no display VGA Graphics not good enough,No Display / No Signal,auto_corrected_from_test
my pc slow performance,Slow Performance,auto_corrected_from_test
Graphics card fan loud and Computer slow,GPU Overheat,auto_corrected_from_test
pc slow after update please,Slow Performance,auto_corrected_from_test
graphics card fan loud,GPU Overheat,auto_corrected_from_test
Monitor not detected and Graphics card upgrade needed,No Display / No Signal,auto_corrected_from_test
pc stuck startup repair problem,Windows Boot Failure,auto_corrected_from_test
fix pc issue,General Repair,auto_corrected_from_test
pc no power at all,PSU / Power Issue,auto_corrected_from_test
PC no signal display also Need better graphics card,No Display / No Signal,auto_corrected_from_test
pc slow loading programs issue,SSD Upgrade,auto_corrected_from_test
"CPU thermal issue, PC slow performance, RAM outdated",CPU Overheat,auto_corrected_from_test
gpu shutdown due to heat,GPU Overheat,auto_corrected_from_test
computer phone not connecting,Phone Connection Issue,auto_corrected_from_test
computer pc not boot,Windows Boot Failure,auto_corrected_from_test
laptop pc no display hdmi,No Display / No Signal,auto_corrected_from_test
PC slow opening files,SSD Upgrade,auto_corrected_from_test
fix cpu overheating,CPU Overheat,auto_corrected_from_test
usb not detected issue,USB / Port Issue,auto_corrected_from_test
wifi not working,Wi-Fi Adapter Upgrade,auto_corrected_from_test
PC start only sometimes plus PC not start after update,PSU / Power Issue,auto_corrected_from_test
pc malfunction please,General Repair,auto_corrected_from_test
PC slow opening files,SSD Upgrade,auto_corrected_from_test
gpu overheat warning please,GPU Overheat,auto_corrected_from_test
PC on blank screen also GPU too weak,No Display / No Signal,auto_corrected_from_test
PC dead after power cut,PSU / Power Issue,auto_corrected_from_test
processor overheating problem,CPU Overheat,auto_corrected_from_test
phone not connecting please,Phone Connection Issue,auto_corrected_from_test
fix screen black pc on,No Display / No Signal,auto_corrected_from_test
bsod error please,Blue Screen (BSOD),auto_corrected_from_test
help pc not working,General Repair,auto_corrected_from_test
WiFi not working USB cable issue,Wi-Fi Adapter Upgrade,auto_corrected_from_test
my internet not working,Wi-Fi Adapter Upgrade,auto_corrected_from_test
help power button not working,PSU / Power Issue,auto_corrected_from_test
PC on blank screen and GPU bottleneck,No Display / No Signal,auto_corrected_from_test
USB port damaged,USB / Port Issue,auto_corrected_from_test
laptop phone not showing,Phone Connection Issue,auto_corrected_from_test
wifi very slow pc,Wi-Fi Adapter Upgrade,auto_corrected_from_test
BSOD error and Boot failure,Blue Screen (BSOD),auto_corrected_from_test
pc start then off issue,PSU / Power Issue,auto_corrected_from_test
computer phone not connecting,Phone Connection Issue,auto_corrected_from_test
graphics card fan loud problem,GPU Overheat,auto_corrected_from_test
computer problem issue,General Repair,auto_corrected_from_test
phone connection problem problem,Phone Connection Issue,auto_corrected_from_test
power button not working problem,PSU / Power Issue,auto_corrected_from_test
my pc can't connect wifi,Wi-Fi Adapter Upgrade,auto_corrected_from_test
GPU hot when gaming also PC very unresponsive,GPU Overheat,auto_corrected_from_test
the no display,No Display / No Signal,auto_corrected_from_test
help pc very slow,Slow Performance,auto_corrected_from_test
help usb not working,USB / Port Issue,auto_corrected_from_test
usb not working problem,USB / Port Issue,auto_corrected_from_test
help usb cable issue,USB / Port Issue,auto_corrected_from_test
laptop pc not detect wifi,Wi-Fi Adapter Upgrade,auto_corrected_from_test
usb cable issue issue,USB / Port Issue,auto_corrected_from_test
computer boot failure,Windows Boot Failure,auto_corrected_from_test
the pc very slow,Slow Performance,auto_corrected_from_test
"PC start then off, Boot failure, Screen black PC on",PSU / Power Issue,auto_corrected_from_test
pc lag always issue,Slow Performance,auto_corrected_from_test
Graphics card fan loud and PC slow performance,GPU Overheat,auto_corrected_from_test
pc usb port broken,USB / Port Issue,auto_corrected_from_test
the pc no display vga,No Display / No Signal,auto_corrected_from_test
pc beep sound issue,RAM Upgrade,auto_corrected_from_test
laptop windows not starting,Windows Boot Failure,auto_corrected_from_test
pc problem unknown issue,General Repair,auto_corrected_from_test
fix phone not detected,Phone Connection Issue,auto_corrected_from_test
PC dead after power cut,PSU / Power Issue,auto_corrected_from_test
help cpu fan not spinning,CPU Overheat,auto_corrected_from_test
pc phone not showing,Phone Connection Issue,auto_corrected_from_test
computer usb not working,USB / Port Issue,auto_corrected_from_test
help internet slow only pc,Wi-Fi Adapter Upgrade,auto_corrected_from_test
laptop gpu shutdown due to heat,GPU Overheat,auto_corrected_from_test
fix internet not working,Wi-Fi Adapter Upgrade,auto_corrected_from_test
pc not start after update,Windows Boot Failure,auto_corrected_from_test
"Monitor no signal, Low FPS problem",No Display / No Signal,auto_corrected_from_test
phone connection problem issue,Phone Connection Issue,auto_corrected_from_test
usb port not working,USB / Port Issue,auto_corrected_from_test
Windows error screen also PC stuck BIOS,Blue Screen (BSOD),auto_corrected_from_test
Processor overheating PC very slow Need more RAM,CPU Overheat,auto_corrected_from_test
help usb port broken,USB / Port Issue,auto_corrected_from_test
internet slow only pc problem,Wi-Fi Adapter Upgrade,auto_corrected_from_test
computer pc not start after update,Windows Boot Failure,auto_corrected_from_test
pc slow after update issue,Slow Performance,auto_corrected_from_test
fix pc slow performance,Slow Performance,auto_corrected_from_test
fix pc not detect wifi,Wi-Fi Adapter Upgrade,auto_corrected_from_test
help cpu hot always,CPU Overheat,auto_corrected_from_test
fix pc dead after power cut,PSU / Power Issue,auto_corrected_from_test
phone not connecting issue,Phone Connection Issue,auto_corrected_from_test
computer pc issue,General Repair,auto_corrected_from_test
help pc not working,General Repair,auto_corrected_from_test
monitor not detected please,No Display / No Signal,auto_corrected_from_test
laptop pc slow performance,Slow Performance,auto_corrected_from_test
internet not working,Wi-Fi Adapter Upgrade,auto_corrected_from_test
GPU thermal issue,GPU Overheat,auto_corrected_from_test
pc pc slow boot,SSD Upgrade,auto_corrected_from_test
pc stuck loading,Windows Boot Failure,auto_corrected_from_test
PC slow loading programs and PC not start after update,SSD Upgrade,auto_corrected_from_test
usb port broken issue,USB / Port Issue,auto_corrected_from_test
computer pc not turning on,PSU / Power Issue,auto_corrected_from_test
PC beep sound,RAM Upgrade,auto_corrected_from_test
laptop phone not recognized,Phone Connection Issue,auto_corrected_from_test
wifi very slow pc problem,Wi-Fi Adapter Upgrade,auto_corrected_from_test
pc stuck loading please,Windows Boot Failure,auto_corrected_from_test
computer problem,General Repair,auto_corrected_from_test
bsod error please,Blue Screen (BSOD),auto_corrected_from_test
help usb not working,USB / Port Issue,auto_corrected_from_test
the no display,No Display / No Signal,auto_corrected_from_test
usb not detected problem,USB / Port Issue,auto_corrected_from_test
Processor overheating also PC slow after update,CPU Overheat,auto_corrected_from_test
Computer slow,Slow Performance,auto_corrected_from_test
system slow overall problem,Slow Performance,auto_corrected_from_test
Monitor no signal Graphics card not detect,No Display / No Signal,auto_corrected_from_test
GPU fan not working PC slow after update,GPU Overheat,auto_corrected_from_test
pc stuck on logo problem,Windows Boot Failure,auto_corrected_from_test
Graphics card too hot and Computer slow,GPU Overheat,auto_corrected_from_test
pc problem unknown,General Repair,auto_corrected_from_test
pc phone connection problem,Phone Connection Issue,auto_corrected_from_test
pc pc start then off,PSU / Power Issue,auto_corrected_from_test
